Code,Category,Description,Size,Total Inventory,Price,Sale Price,Sale End Date
79001,SCOTCH,Forager's Keep 26 Year Old Single Malt Scotch Whisky,750ML,0,325.99,,
38679,RUM,Castillo Silver Rum,1.75L,188,16.99,,
79642,PORT/SHERRY/DESSERT/VERMOUTH,Martini & Rossi Sweet Vermouth Rosso Red Blend,375ML,422,6.79,,
25950,TEQUILA,Cabo Wabo Anejo Tequila,750ML,80,41.99,,
333043,FRANCE,Chateau Beausejour Grand Vin de Bordeaux Fronsac Bordeaux Blend,750ML,14,18.69,,
79780,CORDIALS,Kahlua Cinnamon Spice Liqueur,750ML,13,22.99,,
312295,TEQUILA,Suerte Blanco Tequila,750ML,20,36.99,,
24968,BEER,Green Flash Le Freak - 4 Pack,12.0Z,0,16.99,,
52043,AMERICAN RED,J. Lohr Hilltop Cabernet Sauvignon,375ML,33,14.49,,
31123,BEER,Angry Orchard Easy Apple Hard Cider - 6 Pack,12.0Z,330,9.99,,
10847,AMERICAN RED,Markham Estate Grown Cabernet Sauvignon,750ML,19,33.99,,
25413,BEER,Ass Kisser Double IPA - 12 Pack,12.0Z,0,43.99,,
329138,OTHER WINE,Patricius Reserve Dry Furmint,750ML,0,20.99,,
82119,SPAIN/PORTUGAL,Freixenet Mia White Aromatic & Fruity Cava Blend,750ML,16,10.99,,
28223,SCOTCH,Johnnie Walker Black Label 12 Year Old Blended Scotch Whisky,1.75L,590,74.99,,
336738,CHILE,Emiliana Natura Merlot,750ML,10,9.79,,
348428,AMERICAN BLUSH/ROSE,CLOS DU BOIS ROSE,750ML,0,14.99,,
426199,AMERICAN WHITE,King Estate Acrobat Pinot Gris,750ML,223,14.49,,
40479,ITALY,Tommasi Poggio al Tufo Vigneto Rompicollo Maremma Toscana Sangiovese,750ML,29,16.49,,
56030,CORDIALS,Bols Melon Liqueur,1L,76,10.49,,
411345,ITALY,Conti Beretta Estate Bottled Friuli Grave Pinot Grigio,1.5L,0,12.99,,
313642,SPAIN/PORTUGAL,Bodegas Navalon Anciano Reserva   Aged 7 Years Tempranillo,750ML,243,10.99,,
81372,AMERICAN RED,Almaden Heritage Cabernet Sauvignon,5L,137,20.99,,
81448,AMERICAN WHITE,Smoking Loon The Original Sauvignon Blanc,750ML,163,11.49,,
83513,AMERICAN RED,Barefoot Cellars Sangria Red Blend,750ML,104,8.99,,
21903,AMERICAN RED,St. Supery Vineyards & Winery Estate Bottled Cabernet Sauvignon,750ML,120,37.99,,
10434,BEER,Lagunitas IPA - 6 Pack,12.0Z,1206,10.99,,
1546,BEER,Cusquena Dorada - 6 Pack,12.0Z,617,9.99,,
14753,FRANCE,Georges Vigouroux Gouleyant Cahors Malbec,750ML,187,12.99,,
28665,AMERICAN RED,Clos du Bois Hand Selected Lots Shiraz,750ML,17,14.49,,
312431,RUM,Diplomatico Reserva Exclusiva Rum,750ML,194,32.99,,
36390,VODKA,Absolut Vodka,1L,230,30.99,,
85065,AMERICAN WHITE,J. Lohr Riverstone Chardonnay,750ML,604,13.99,,
341815,AMERICAN RED,Roco Marsh Estate Vineyard Pinot Noir,750ML,0,44.99,,
97667,BEER,Beck's Pils - 12 Pack,12.0Z,1440,17.99,,
336062,AMERICAN RED,Mija Sangria Red Blend,750ML,1,9.49,,
82465,AMERICAN WHITE,Corbett Canyon Sauvignon Blanc,1.5L,279,8.99,,
311779,ITALY,Impero Terre di Chieti IGT Pinot Grigio,1.5L,1,16.99,,
42908,ASIA,Japon Sake,300ML,14,16.99,,
72646,TEQUILA,Jose Cuervo Especial Silver Tequila,750ML,960,17.99,15.99,04/30/2019
316397,AMERICAN RED,Angela Estate Pinot Noir,750ML,7,52.99,,
341098,CANADIAN/BLENDED WHISKEY,High West Campfire Blended Malt Scotch Whisky,750ML,49,76.99,,
70417,CANADIAN/BLENDED WHISKEY,Fireball Cinnamon Whisky,50ML,6735,1.29,,
47180,CORDIALS,Southern Comfort Original Liqueur,750ML,258,14.49,,
24857,BEER,Takara Can Chu Hi JPop Grapefruit - 6 Pack,12.0Z,0,17.99,,
11619,AMERICAN RED,La Catrina Cabernet Sauvignon,750ML,0,12.99,,
2984,BEER,He'Brew Genesis Dry Hopped Session Ale - 6 Pack,12.0Z,0,12.99,,
80291,ARGENTINA,Dona Paula Estate Malbec,750ML,260,16.49,,
83380,AMERICAN WHITE,Estancia Chardonnay,750ML,292,14.49,11.99,04/30/2019
95583,BEER,Tecate Original - 12 Pack,12.0Z,792,14.99,,
25768,BEER,Schlafly Oktoberfest - 6 Pack,12.0Z,0,11.99,,
42293,AMERICAN RED,Edge Cabernet Sauvignon,750ML,22,31.99,,
346265,AMERICAN BLUSH/ROSE,Seaglass Rose Pinot Noir,750ML,4,10.69,,
22751,BEER,Beerlao Dark Lager - 6 Pack,12.0Z,0,12.99,,
98043,BEER,Hitachino Nest Red Rice Ale - 6 Pack,11.2Z,0,31.99,,
48020,,STORE SPECIAL LIQUOR 750ML,750ML,1,0.49,,
79713,VODKA,Skinnygirl Tangerine Vodka,750ML,11,17.49,,
38504,RUM,Castillo Gold Rum,750ML,84,6.99,,
329503,CHAMPAGNE/SPARKLING,Piera Martellozzo Blu Giovello Moscato Puglia IGT Muscat,750ML,0,8.49,,
46329,AMERICAN RED,St. Francis Old Vines Zinfandel,750ML,215,21.99,,
40895,BEER,Troegs LaGrave - 4 Pack,12.7Z,44,12.99,,
23353,AMERICAN RED,Rex Goliath Free Range Giant 47 Pound Rooster Merlot,750ML,0,7.79,,
27927,BEER,Gulden Draak 9000 Quadruple - 4 Pack,11.2Z,0,21.99,,
310491,SPAIN/PORTUGAL,Castillo de Maluenda Vinas Viejas Punto y Coma Garnacha,750ML,2,12.99,,
75470,BOURBON/RYE,Woodford Reserve Distiller's Select Kentucky Straight Bourbon Whiskey,1.75L,262,65.99,,
34398,OTHER WINE,Four Seasons Collection Late Harvest White Moscato Dessert Muscat,500ML,0,7.69,,
11418,IRISH WHISKEY,West Cork 10 Year Old Single Malt Irish Whiskey,750ML,90,38.99,,
335762,ITALY,Agricola Punica Barrua Isola Dei Nuraghi IGT Carignan,750ML,0,46.99,,
59781,,Aletta Veraz Garnacha,750ML,1,0.25,,
80111,CHAMPAGNE/SPARKLING,Moet & Chandon Ice Imperial Demi Sec Champagne,750ML,161,54.99,49.99,04/30/2019
83681,AMERICAN RED,Madria Sangria Tradicional Fresh Citrus Red Blend,750ML,183,6.99,,
80620,AMERICAN WHITE,Walter Hansel Winery The Estate Vineyards Chardonnay,750ML,0,34.99,,
336940,ARGENTINA,Bodega Ruca Malen Reserva Malbec,750ML,23,21.99,,
17876,GIN,Boodles British London Dry Gin,1.75L,65,35.99,,
83640,AUSTRALIA,Rosemount Estate Diamond Label Shiraz,750ML,2,11.49,,
13188,AUSTRALIA,"Yellow Tail Shiraz, Cabernet Sauvignon",750ML,239,6.79,,
46336,ASIA,Myungjak Bokbunja,375ML,60,6.99,,
338804,VODKA,Black Button Wheat Vodka,750ML,76,35.99,,
306923,CORDIALS,Hum Botanical Spirit Liqueur,750ML,15,41.99,,
24159,BEER,Brasserie de Silly Saison - 4 Pack,11.2Z,16,16.99,,
425869,GREECE,Kotrotsos Erasmios Red Dry Agiorgitiko,750ML,19,9.79,,
47988,NEW ZEALAND,Matua Valley Sauvignon Blanc,750ML,963,12.99,,
93289,BEER,Victory HopDevil IPA - 6 Pack,12.0Z,228,9.99,,
166432,MIXERS,Cutwater Fugu Grapefruit Vodka Soda - 4 Pack,12.0Z,759,15.96,,
46198,KOSHER,Binyamina Yogev Cabernet Sauvignon,750ML,21,15.99,,
10405,BEER,UINTA PALE ALE NR - 6 Pack,12.0Z,0,11.99,,
79383,CHAMPAGNE/SPARKLING,Freixenet Carta Nevada Brut Cava Blend,750ML,170,10.69,,
342521,CANADIAN/BLENDED WHISKEY,Compass Box This Is Not A Luxury Whisky,750ML,13,239.99,,
60047,BEER,Troegenator Double Bock Can - 12 Pack,12.0Z,0,20.99,,
94048,BEER,SAM ADAMS GAMEDAY VARIETY 2/12 NR - 12 Pack,12.0Z,-60,19.99,,
313090,CHAMPAGNE/SPARKLING,Cavit Lunetta Rose Rare Rose Blend,750ML,2,12.99,,
158070,ITALY,Brunellesco Delle Venezie IGT Pinot Grigio,1.5L,0,17.39,,
25746,BEER,Maui Brewing Big Swell IPA - 6 Pack,12.0Z,0,12.99,,
77280,CORDIALS,Grand Marnier Cuvee 1880 Liqueur,750ML,24,286.99,,
108367,FRANCE,Domaine des Caves du Prieure Sancerre Sauvignon Blanc,750ML,32,22.99,,
32190,GIN,Bombay Dry Gin,1L,189,29.99,,
84967,AUSTRALIA,Yellow Tail Sweet Red Roo Rare Red Blend,750ML,241,6.79,,
10609,BEER,Firestone Walker Luponic Distortion Can - 6 Pack,12.0Z,24,11.99,,
82504,AMERICAN RED,Peter Vella Sangria Red Blend,5L,113,14.99,,
84935,BEER,3 Stars Above The Clouds Can - 6 Pack,12.0Z,318,9.99,,
95710,BEER,Guinness Draught - 4 Pack,14.9Z,966,8.99,,
349579,ARGENTINA,Finca Las Moras Barrel Select Cabernet Sauvignon,750ML,0,14.99,,
339711,AMERICAN WHITE,Saracina Unoaked Chardonnay,750ML,0,20.99,,
83616,AMERICAN RED,Matchbook The Arsonist Bordeaux Blend,750ML,0,24.99,,
29733,BEER,Roy Pitz Sour Hound - 6 Pack,12.0Z,0,13.99,,
50903,CORDIALS,Villa Massa Limoncello Liqueur,750ML,173,25.99,,
332066,FRANCE,LA CHASSE PRETIGE CDR,750ML,0,11.99,,
87169,CHAMPAGNE/SPARKLING,Barefoot Cellars Bubbly Pink Moscato Muscat,187ML,259,3.39,,
342150,RUM,RumChata Horchata Con Ron Cream Liqueur,375ML,43,17.99,,
96105,BEER,Mike's Hard Limeade - 6 Pack,11.2Z,43,9.99,,
405922,KOSHER,Cantina Gabriele Dry Red Wine Lazio IGT Cabernet Sauvignon,750ML,32,12.49,,
50130,CORDIALS,Kahlua Original Coffee Liqueur,1L,288,29.99,,
18023,GIN,Boodles British London Dry Gin,1L,89,28.99,,
402435,AMERICAN WHITE,A to Z Wineworks Riesling,750ML,94,16.49,,
341320,AMERICAN RED,Matchbook Rose Estate Bottled Tempranillo,750ML,0,12.69,,
43114,AMERICAN RED,Adelsheim Ribbon Springs Auxerrois,750ML,0,25.99,,
30546,GIN,Burnett's White Satin Gin,750ML,24,8.49,,
157929,ITALY,Marchesi di Barolo Ruvei Barbera d'Alba,750ML,0,15.99,,
96008,BEER,Asahi Super Dry - 6 Pack,12.0Z,540,9.99,,
92657,BEER,ICEHOUSE 4/6 LNNR - 24 Pack,12.0Z,0,23.99,,
74084,MISCELLANEOUS IMPORTED,Montelobos Joven Mezcal,750ML,135,33.99,,
21993,BEER,Shipyard Summer Ale - 6 Pack,12.0Z,0,12.99,,
56103,ARGENTINA,Bodega Catena Zapata High Mountain Vines Malbec,750ML,257,23.99,,
400424,AMERICAN RED,Angeline Winery Pinot Noir,750ML,256,13.49,,
20214,AMERICAN RED,Silver Oak Cabernet Sauvignon,750ML,104,91.99,,
302121,VODKA,PInnacle Chocolate Whipped Vodka,750ML,4,10.99,,
10346,BEER,Kloud Original Gravity - 6 Pack,330ML,120,11.99,,
77593,AMERICAN RED,Kendall Jackson Vintner's Reserve Cabernet Sauvignon,375ML,222,12.49,,
11360,BEER,Lagunitas 12th Of Never Ale - 12 Pack,12.0Z,12,21.99,,
43425,VODKA,Stolichnaya Strasberi Vodka,1L,10,28.99,,
72528,BRANDY/COGNAC/GRAPPA,Ciroc VS French Brandy,750ML,165,33.99,,
397121,AMERICAN RED,Girard Cabernet Sauvignon,750ML,46,28.99,,
49339,CHAMPAGNE/SPARKLING,Bertrand Senecourt Beau Joie Special Cuvee Sugar King Champagne Demi Sec,750ML,1,74.99,,
428922,KOSHER,Baron Herzog Jeunesse Chardonnay,750ML,0,11.49,,
57037,CORDIALS,Gran Gala Rare Triple Orange Liqueur,750ML,277,17.99,,
35211,VODKA,Smirnoff No. 21 Vodka,50ML,5940,0.99,,
82570,AMERICAN WHITE,Honig Sauvignon Blanc,750ML,110,16.69,,
300644,CANADIAN/BLENDED WHISKEY,Suntory Toki Japanese Whisky,750ML,344,33.99,29.99,04/30/2019
47812,VODKA,Pinnacle Cherry Whipped Vodka,750ML,2,10.99,,
326544,KOSHER,Mount Tabor Estate Shiraz,750ML,5,15.99,,
232282,GERMANY,Oh Be Joyful Sweet Deutscher Qualitatswein Dornfelder,750ML,0,12.99,,
48281,VODKA,Zachlawi Sweet Potato Vodka,750ML,9,29.99,,
23274,BEER,Moorhouse's English Owd Ale - 4 Pack,16.9Z,0,18.99,,
301616,ITALY,Familia Dante Twelve Months Oak Aged Toscana IGT Sangiovese,750ML,0,13.69,,
29338,BEER,Meta Beer - 6 Pack,11.2Z,36,12.99,,
10406,BEER,Uinta Ready Set Gose - 6 Pack,12.0Z,0,11.99,,
330252,CHAMPAGNE/SPARKLING,Cavit Lunetta Rose Rare Rose Blend,187ML,1,4.79,,
11453,CANADIAN/BLENDED WHISKEY,Jackson Morgan Salted Caramel Liqueur,750ML,17,23.99,,
75400,AMERICAN TABLE,Arbor Mist Blackberry Merlot,750ML,0,6.19,,
28738,CANADIAN/BLENDED WHISKEY,Seagram's VO Canadian Whisky,200ML,26,5.49,,
342131,SPAIN/PORTUGAL,Bodegas Juan Gil Honoro Vera Verdejo,750ML,61,9.99,,
72444,RUM,Sugar Island Spiced Rum,750ML,0,21.99,,
85968,AMERICAN RED,Ghost Pines Winemaker's Blend Rare Red Blend,750ML,174,18.99,,
166285,AMERICAN TABLE,Sutter Home Winery Moscato Sangria Muscat,1.5L,67,12.99,,
70541,BRANDY/COGNAC/GRAPPA,D'usse VSOP Cognac,750ML,257,50.99,,
87645,AMERICAN RED,Robert Mondavi Winery Cabernet Sauvignon,750ML,227,30.99,,
81906,AMERICAN WHITE,Corbett Canyon Chardonnay,1.5L,464,8.99,,
86544,SCOTCH,Buchanan's Master Blended Scotch Whisky,750ML,64,64.99,,
71980,VODKA,Don Corleone Organic Gold Vodka,750ML,48,41.99,,
429478,CHILE,TerraNoble Reserva La Higuera Vineyard Carmenere,750ML,0,10.99,,
321533,SPAIN/PORTUGAL,Quinta de Soalheiro Soalheiro Alvarinho,750ML,6,23.99,,
22604,BEER,Belhaven Scottish Stout - 4 Pack,16.9Z,0,23.99,,
349431,CANADIAN/BLENDED WHISKEY,Label 5 Classic Black Blended Scotch Whisky,750ML,8,15.99,,
78712,VODKA,Pearl Wedding Cake Vodka,750ML,10,12.49,,
70711,BRANDY/COGNAC/GRAPPA,Hardy Red Corner VS Fine Cognac,1.75L,8,66.99,,
433983,GERMANY,Heinz Eifel Kabinett Riesling,750ML,5,11.99,,
74152,AMERICAN RED,Robert Mondavi Winery Private Selection Merlot,750ML,272,12.49,9.99,04/30/2019
82313,AMERICAN RED,Skyfall Vineyards Cabernet Sauvignon,750ML,31,15.49,,
76056,CORDIALS,Galliano L'Autentico Liqueur,750ML,54,30.99,,
310078,NEW ZEALAND,Fire Road Pinot Noir,750ML,23,16.99,,
47530,CORDIALS,Cocchi Americano Aperitif,750ML,32,21.99,,
349244,AMERICAN WHITE,Beringer Vineyards Beringer Bros. Bourbon Barrel Aged Chardonnay,750ML,144,16.99,,
50767,BEER,Corona Familiar - 6 Pack,12.0Z,143,9.99,,
84359,FRANCE,Chateau Rieussec 1er Grand Cru Classe 1855 Sauternes Semillon,750ML,27,81.99,,
313969,AMERICAN BLUSH/ROSE,Barefoot Cellars Pink Moscato Deliciously Sweet Muscat,1.5L,237,15.49,,
319771,,Angostura Aromatic Bitters,16.0Z,111,26.25,,
70109,VODKA,Deep Eddy Ruby Red Grapefruit Vodka,750ML,368,14.99,,
138967,AMERICAN RED,Waterbrook Cabernet Sauvignon,750ML,22,14.99,,
406198,SPAIN/PORTUGAL,Ermita de Petrer Tinto Organic Alicante,750ML,0,8.99,,
300731,AMERICAN WHITE,The Eyrie Vineyards Pinot Gris,750ML,0,20.99,,
40720,ARGENTINA,Luigi Bosca Finca La Linda Malbec,750ML,376,10.99,,
25407,BEER,New Belgium Voodoo Ranger Imperial IPA - 6 Pack,12.0Z,498,9.99,,
31427,BEER,SCHLAFLY STOUT BOUT SAMPLER   2/12 - 12 Pack,12.0Z,0,22.99,,
32883,AUSTRALIA,Yalumba Y Series Viognier,750ML,114,13.99,,
43781,FRANCE,CH TOUR D'AURON,750ML,0,15.99,,
342148,SOUTH AFRICA,Wildlife Chardonnay,750ML,29,8.99,,
48221,GERMANY,Schmitt Sohne Spatlese Piesporter Michelsberg Riesling,750ML,20,12.99,,
41934,AUSTRALIA,Thorn Clarke Terra Barossa Importers Reserve Cabernet Sauvignon,750ML,4,16.49,,
361933,AMERICAN RED,Sea Ridge Cabernet Sauvignon,750ML,0,5.99,,
78169,SCOTCH,Big Peat Small Batch Islay Blended Malt Scotch Whisky,750ML,0,75.99,,
42838,CORDIALS,Disaronno Originale Amaretto Liqueur,750ML,293,25.99,,
72373,RUM,Stonewall American Rum,750ML,25,27.99,,
40344,AMERICAN RED,14 Hands Merlot,750ML,439,12.49,10.99,04/30/2019
43921,FRANCE,Chateau de Segries Cuvee Reservee Lirac Red Southern Rhone Blend,750ML,10,15.99,,
348402,VODKA,Svedka Vodka,50ML,1643,0.99,,
74845,CORDIALS,Romana Sambuca Liquore Classico,50ML,143,2.99,,
85308,AMERICAN TABLE,Franzia Crisp White Blend,5L,198,15.99,,
20109,IRISH WHISKEY,Jameson Irish Whiskey,1.75L,495,55.99,,
70926,VODKA,Kurant 1852 Crystal Limited Edition Vodka,750ML,4,40.99,,
321392,ITALY,Carpineto Dogajolo Toscana IGT Sangiovese,750ML,61,13.99,,
321806,ARGENTINA,Liberty Creek Pink Moscato Muscat,1.5L,50,9.49,,
76623,VODKA,UV Blue Raspberry Vodka,750ML,0,10.49,,
86975,AMERICAN RED,J. Lohr Los Osos Merlot,750ML,184,15.49,,
74722,TEQUILA,Margaritaville Silver Tequila,1.75L,27,26.99,,
342104,VODKA,Deep Eddy Lemon Vodka,1.75L,199,26.99,22.99,04/30/2019
63026,BEER,Evolution Craft Stalker Hefeweizen - 6 Pack,12.0Z,0,10.99,,
48108,AMERICAN RED,Beringer Vineyards Stone Cellars Shiraz,750ML,0,7.49,,
55182,MIXERS,Chi Chi's Mexican Mudslide,1.75L,110,10.79,,
73313,BOURBON/RYE,Jefferson's Reserve Twin Oak Custom Barrel Kentucky Straight Bourbon Whiskey,750ML,69,70.99,,
97799,BEER,Wychwood Hobgoblin,16.9Z,0,5.99,,
178918,ITALY,Ca'Lunghetta Pinot Grigio,750ML,30,10.99,,
50701,BEER,Shiner Sea Salt & Lime - 6 Pack,12.0Z,24,9.99,,
40185,BRANDY/COGNAC/GRAPPA,E&J VS Brandy,375ML,675,6.69,,
72845,RUM,Flor de Cana 25 Year Old Rum,750ML,8,143.99,,
46342,VODKA,Rain Cucumber Vodka,750ML,34,18.99,,
311347,AMERICAN RED,Sean Minor Pinot Noir,750ML,1,22.99,,
346795,SPAIN/PORTUGAL,Beso del Sol White Sangria Airen,3L,25,20.99,,
409464,SPAIN/PORTUGAL,Broadbent Loureiro,750ML,87,11.39,,
431389,ITALY,La Fiera Montepulciano D'Abruzzo DOC,750ML,148,8.49,,
166268,AMERICAN RED,Joel Gott Pinot Noir,750ML,100,16.99,,
84541,AMERICAN RED,The Hess Collection Hess Select Pinot Noir,750ML,18,15.99,,
80273,AMERICAN WHITE,The Naked Grape (US) Stays Fresh Box Chardonnay,3L,53,19.99,16.99,04/30/2019
17515,CHAMPAGNE/SPARKLING,Saint Hilaire Brut Estate Bottled Blanquette de Limoux Mauzac,750ML,279,12.69,,
29201,BEER,Silly Sour - 4 Pack,11.2Z,20,16.99,,
47403,VODKA,Smirnoff Cranberry Vodka,375ML,12,7.69,,
41478,GERMANY,Loosen Bros. Dr. L Riesling,750ML,269,12.99,,
38806,RUM,Castillo Silver Rum,1L,320,7.39,,
70029,BOURBON/RYE,Bowman Brothers Pioneer Spirit Small Batch Virginia Straight Bourbon Whiskey,750ML,1,29.99,,
37010,VODKA,Hangar 1 Straight Vodka,750ML,28,28.99,,
313326,ITALY,Malatestiane Baciami Albana di Romagna,750ML,0,10.99,,
82415,CHAMPAGNE/SPARKLING,Korbel Sweet Rose Methode Champenoise Pinot Noir,750ML,336,14.99,,
47437,CORDIALS,Lazzaroni Maraschino Liqueur,750ML,35,20.99,,
39187,VODKA,Ketel One Citroen Vodka,1.75L,76,49.99,,
122394,AMERICAN RED,Santa Barbara Winery Pinot Noir,750ML,0,21.99,,
44592,AMERICAN RED,Stuhlmuller Vineyards Estate Cabernet Sauvignon,750ML,0,49.99,,
309402,AMERICAN WHITE,The Dreaming Tree Chardonnay,750ML,189,15.49,,
62065,PORT/SHERRY/DESSERT/VERMOUTH,Christian Brothers Dry Sherry Sherry Blend,1.5L,1,10.49,,
75187,IRISH WHISKEY,The Tyrconnell 16 Year Old Single Malt Irish Whiskey,750ML,16,108.99,,
11840,ITALY,Risata Sweet Red Moscato Muscat,750ML,98,14.69,,
81086,AMERICAN RED,Robert Mondavi Winery Private Selection Pinot Noir,750ML,322,12.49,9.99,04/30/2019
29451,BEER,North Coast Le Merle - 4 Pack,12.0Z,0,13.99,,
363294,OTHER WINE,Yaegaki Mu Junmai Daiginjo Sake,300ML,0,18.39,,
46159,ITALY,Antinori Gran Selezione Badia a Passignano Chianti Classico DOCG Sangiovese,750ML,0,50.99,,
12686,BEER,Founders Centennial IPA Can - 15 Pack,12.0Z,5,21.99,,
86746,AMERICAN TABLE,Taylor Country Cellars White Blend,3L,79,10.49,,
40406,AMERICAN RED,Gary Farrell Russian River Selection Pinot Noir,750ML,23,42.99,,
21940,BEER,Aldaris Gai�ais - 4 Pack,16.9Z,0,10.99,,
40979,AMERICAN RED,Mark West Pinot Noir,1.5L,294,21.99,16.99,04/30/2019
81708,AMERICAN WHITE,Duckhorn Vineyards Decoy Sauvignon Blanc,750ML,359,19.99,,
331334,CHAMPAGNE/SPARKLING,Heidsieck & Co. Monopole Gold Top Brut Champagne Brut,750ML,0,66.99,,
310007,KOSHER,Binyamina Bin Cabernet Sauvignon,750ML,20,11.99,,
70566,RUM,RumHaven Coconut Rum Liqueur,50ML,52,1.69,,
333432,SPAIN/PORTUGAL,Vina Cartin Albarino,750ML,32,15.49,,
72460,SPAIN/PORTUGAL,Marques de Riscal Verdejo,750ML,297,8.99,,
6696,BEER,Samichlaus Classic - 6 Pack,11.2Z,0,39.99,,
71488,IRISH WHISKEY,Slane Triple Casked Irish Whiskey,750ML,153,26.99,,
301520,CHILE,Estampa Estate Malbec,750ML,0,10.99,,
339963,ITALY,Rocca delle Macie Head to Head Red Toscana IGT Rare Red Blend,750ML,0,11.99,,
339230,CHILE,Tinajas del Maule Viejo Feo Villa Alegre Reserve Estate Bottled Carmenere,750ML,32,9.99,,
12971,BOURBON/RYE,Ten High Sour Mash Kentucky Bourbon Whiskey,1L,209,9.49,,
337843,AMERICAN RED,Conn Creek Herrick Red Rare Red Blend,750ML,0,21.99,,
47541,FRANCE,Chateau de Flaugergues Cuvee Sommeliere La Mejanelle White Southern Rhone Blend,750ML,0,18.99,,
36374,VODKA,Platinum 7X Vodka Seven Times Distilled,750ML,341,9.49,8.49,04/30/2019
70445,CORDIALS,Davinia Hazelnut Liqueur,750ML,22,16.99,,
65366,VODKA,Stolichnaya Elit New Zealand Edition Vodka,750ML,52,60.99,,
23275,BEER,Moorhouse's Blond Witch - 4 Pack,16.9Z,0,18.99,,
33871,AUSTRALIA,Wolf Blass Yellow Label Shiraz,750ML,0,10.99,,
85618,AMERICAN WHITE,Peter Vella Chardonnay,5LTR,104,19.99,,
46229,CORDIALS,The Bitter Truth Spiced Chocolate Bitters,200ML,24,24.99,,
76152,TEQUILA,Clase Azul Reposado Tequila,750ML,78,100.99,,
336593,CHILE,Vina San Esteban Reserve Malbec,1.5L,0,12.69,,
24954,BEER,Caldera Ashland Amber - 6 Pack,12.0Z,0,15.99,,
423912,NEW ZEALAND,Clifford Bay Sauvignon Blanc,750ML,17,10.79,,
333359,AMERICAN RED,Freemark Abbey Bosche Cabernet Sauvignon,750ML,0,99.99,,
35025,BRANDY/COGNAC/GRAPPA,Cerbois Bas Armagnac VSOP Brandy,750ML,29,44.99,,
76024,BOURBON/RYE,Old Fitzgerald 9 Year Old Bottled In Bond Kentucky Straight Bourbon Whiskey,750ML,0,79.99,,
24138,BEER,Anderson Valley Boont Amber Ale Can - 6 Pack,12.0Z,0,13.99,,
23613,BEER,'t Gaverhopke Zingende Blondine - 6 Pack,11.2Z,0,39.99,,
81164,FRANCE,Chateau de Chantegrive Graves Cabernet Sauvignon,750ML,83,22.99,,
69256,AMERICAN WHITE,Woodbridge Riesling,1.5L,228,14.49,11.99,04/30/2019
86744,AMERICAN WHITE,Dark Horse Wines The Original Dark Horse Chardonnay,750ML,404,9.99,,
85766,AMERICAN WHITE,La Crema Chardonnay,750ML,690,22.99,,
75592,VODKA,Smirnoff Vodka 100 Proof,1L,12,18.99,,
348436,AMERICAN BLUSH/ROSE,Chateau Ste. Michelle Rose Syrah,750ML,176,11.99,,
27081,SCOTCH,The Famous Grouse Blended Scotch Whisky,1.75L,200,38.99,,
12421,SCOTCH,Glen Grant Rothes 12 Year Old Speyside Single Malt Scotch Whisky,750ML,70,39.99,39.89,04/30/2019
94072,BEER,Coors Light - 24 Pack,12.0Z,0,29.99,,
391077,AMERICAN WHITE,Liberty Creek Winemaker's Selection Chardonnay,1.5L,51,9.49,,
70139,VODKA,Burnett's Hot Cinnamon Vodka,750ML,12,7.69,,
310163,CHAMPAGNE/SPARKLING,Krug Grande Cuvee Brut Champagne,375ML,3,105.99,,
80189,CHAMPAGNE/SPARKLING,Cupcake Vineyards Moscato D'Asti DOCG Muscat Blanc a Petits Grains,750ML,274,14.69,,
83410,AMERICAN RED,Sebastiani Vineyards & Winery Cabernet Sauvignon,750ML,64,18.99,,
84285,AMERICAN RED,Bridlewood Estate Winery Blend 175 Syrah,750ML,38,12.99,,
24715,BEER,Southern Tier 2XMAS Ale - 6 Pack,12.0Z,0,11.99,,
303562,FRANCE,Barons de Rothschild (Lafite) Val De L'Ours Cabernet Sauvignon,750ML,0,26.99,,
322615,PORT/SHERRY/DESSERT/VERMOUTH,Rainha Santa Lacrima,750ML,0,10.99,,
40438,SCOTCH,The Glenlivet 12 Year Old Single Malt Scotch Whisky,50ML,339,3.99,,
314917,FRANCE,Charles Brotte Grand Vallon Syrah,750ML,0,9.79,,
59994,GERMANY,Kuhl Weinhaus Kuhl Qualitatswein Riesling,750ML,9,11.99,,
29372,BEER,Green Flash Citra Session IPA - 6 Pack,12.0Z,0,13.99,,
34851,RUM,Goslings Black Seal Bermuda Black Rum,1.75L,220,31.99,27.99,04/30/2019
309216,AMERICAN RED,Plumpjack Estate Cabernet Sauvignon,750ML,0,142.99,,
305254,SOUTH AFRICA,Badenhorst Family Wines Secateurs Red Blend Cinsault,750ML,1,18.39,,
14044,KOSHER,Barkan Classic Cabernet Sauvignon,750ML,352,11.99,,
66060,ITALY,Ecco Domani Delle Venezie IGT Pinot Grigio,750ML,813,11.39,,
78735,SPAIN/PORTUGAL,Marques de Caceres Verdejo,750ML,25,9.99,,
28797,CANADIAN/BLENDED WHISKEY,Canadian Mist Blended Canadian Whisky,1.75L,537,16.49,14.99,04/30/2019
418862,ARGENTINA,Ernesto Catena Padrillos Malbec,750ML,0,9.99,,
328998,CHILE,Vina Casablanca Nimbus Single Vineyard Sauvignon Blanc,750ML,0,15.69,,
46264,AMERICAN RED,Trinity Oaks Cabernet Sauvignon,750ML,0,7.99,,
192414,FRANCE,Saint Hilaire d'Ozilhan Reserve de la Dame a l'Oiseau Cotes du Rhone Red Southern Rhone Blend,750ML,0,10.79,,
81057,AMERICAN RED,Peter Vella Moscato Sangria Muscat Blanc a Petits Grains,5L,83,14.99,,
81798,AMERICAN WHITE,Mirassou Vineyards Pinot Grigio,750ML,196,11.49,,
29281,BEER,Evil Twin Falco,16.0Z,0,2.99,,
73513,VODKA,New Amsterdam Vodka,750ML,485,11.99,,
3573,BEER,Baltika #7 Export - 6 Pack,330ML,0,14.99,,
35556,VODKA,Skol Vodka,750ML,87,6.69,,
80186,ITALY,Luccio Pink Moscato Muscat,750ML,0,7.69,,
80218,AUSTRALIA,Jacob's Creek Two Lands Shiraz,750ML,7,12.99,,
308406,FRANCE,Hecht & Bannier Languedoc Syrah,750ML,26,13.69,,
346097,AMERICAN BLUSH/ROSE,Chloe Wines Rose Pinot Noir,750ML,182,14.49,,
316678,FRANCE,Lionel Gosseaume Touraine Sauvignon Blanc,750ML,0,16.99,,
43663,OTHER WINE,MURFATLAR MUSCAT OTTONEL,750ML,0,12.99,,
346640,AMERICAN RED,Seven Kingdoms Wines Game of Thrones Rare Red Blend,750ML,1,18.99,,
11436,VODKA,Svedka Citron Vodka,750ML,165,10.99,,
46143,SPAIN/PORTUGAL,Quinta do Vallado Tinto Portuguese Red Blend,750ML,2,11.99,,
82775,AMERICAN WHITE,Fetzer Sundial Chardonnay,750ML,265,10.49,8.99,04/30/2019
337955,AMERICAN RED,Francis Ford Coppola Director's Cut Pinot Noir,750ML,0,14.69,,
76279,AMERICAN WHITE,Almaden Heritage Almaden Vineyards Chardonnay,1.5L,0,9.79,,
40949,ITALY,Castello di Querceto / Querceto Chianti Classico DOCG Chianti Blend,750ML,0,17.49,,
27545,SCOTCH,Johnnie Walker Red Label Blended Scotch Whisky,750ML,757,20.99,17.99,04/30/2019
22321,BEER,Abita Christmas Ale - 6 Pack,12.0Z,0,11.99,,
42226,CORDIALS,Hiram Walker Peppermint Flavored Schnapps 60 Proof,375ML,127,5.69,,
41173,BRANDY/COGNAC/GRAPPA,Hennessy V.S Cognac,1.75L,338,85.99,,
47484,FRANCE,Eric Louis Sancerre Sauvignon Blanc,750ML,14,21.99,,
50733,CORDIALS,Kahlua Original Coffee Liqueur,1.75L,205,48.99,,
50644,BEER,Truly Spiked & Sparkling Wild Berry - 6 Pack,12.0Z,270,9.99,,
28398,SCOTCH,Scoresby Very Rare Blended Scotch Whisky,1.75L,27,32.99,,
335162,ITALY,Tre Baci Rosato Veneto IGT Merlot,750ML,0,4.39,,
324405,AMERICAN RED,Les Domaines Paul Mas la Madeleine Cabernet Sauvignon,750ML,0,10.99,,
97586,BEER,Bud Light - 24 Pack,12.0Z,187,25.99,,
47419,VODKA,Pinnacle Grape Vodka,1L,1,14.99,,
24747,BEER,Spire Mountain Sparkling Pear Cider - 6 Pack,12.0Z,0,13.99,,
232398,RUM,Tobacco Barn Big Z Rum,750ML,106,50.99,,
44804,BOURBON/RYE,Noah's Mill Bourbon Whiskey,750ML,105,61.99,,
95702,BEER,Boddingtons Pub Ale - 4 Pack,16.0Z,293,8.99,,
79740,PORT/SHERRY/DESSERT/VERMOUTH,Cinzano Vermouth Rosso Red Blend,750ML,204,8.49,,
82470,AMERICAN RED,Ghost Pines Winemaker's Blend Merlot,750ML,184,16.49,,
10265,ARGENTINA,Vinas Riojanas La Chaya Winemaker's Selection Cabernet Sauvignon,750ML,0,7.79,,
35424,VODKA,Smirnoff Twist Of Raspberry Vodka,1.75L,160,25.99,22.99,04/30/2019
351452,MISCELLANEOUS IMPORTED,Shinju Japanese Whisky,750ML,121,49.99,45.89,04/30/2019
71485,VODKA,Twenty Grand Apple Vodka Infused with Cognac,750ML,21,30.99,,
70088,VODKA,Absolut Pears Vodka,1L,183,30.99,,
71237,RUM,Captain Morgan Grapefruit Rum,750ML,66,16.49,,
51500,VODKA,Belvedere Citrus Vodka,750ML,59,31.99,,
38571,TEQUILA,Pepe Lopez Silver Tequila,1L,344,10.15,,
50236,BEER,Southern Tier Imperial Cinnamon Roll Ale - 4 Pack,12.0Z,19,15.99,,
71678,VODKA,Smirnoff Sourced Ruby Red Grapefruit Vodka,750ML,18,13.49,,
336247,AMERICAN BLUSH/ROSE,Union Wine Company Underwood Rose Can Pinot Gris,375ML,118,8.99,,
345425,VODKA,Western Son Ruby Red Grapefruit Vodka,750ML,9,18.99,,
92630,BEER,Bud Ice Can - 24 Pack,12.0Z,0,30.99,,
88707,AMERICAN WHITE,The Calling Dutton Ranch Chardonnay,750ML,8,26.99,,
76849,VODKA,New Amsterdam Lemon Vodka,750ML,111,11.99,,
301921,CHAMPAGNE/SPARKLING,Wycliff Brut California Champagne Champagne Blend,750ML,271,5.79,,
51551,CORDIALS,Rumple Minze Peppermint Schnapps,750ML,1,19.99,,
47127,CORDIALS,TUACA Liqueur,50ML,21,1.89,,
23075,BEER,LandShark Lager - 6 Pack,12.0Z,505,8.49,,
340122,ARGENTINA,Alma De Los Andes Reserva Malbec,750ML,121,13.49,,
46449,MIXERS,Skinnygirl Margarita,750ML,195,11.99,,
46127,KOSHER,GAMLA GALILEE WH/RIES,750ML,0,13.69,,
93316,BEER,Belhaven Wee Heavy Ale - 4 Pack,16.9Z,0,22.99,,
