Code,Category,Description,Size,Total Inventory,Price,Sale Price,Sale End Date
15008,TEQUILA,Montezuma Aztec Gold Tequila,1L,610,11.99,,
317503,AMERICAN WHITE,A by Acacia Unoaked Chardonnay,750ML,22,12.99,11.59,04/30/2019
394513,AMERICAN RED,Vina Robles RED4 Red Southern Rhone Blend,750ML,0,13.99,,
325957,AMERICAN RED,Belle Ambiance Family Vineyards Pinot Noir,750ML,131,11.49,8.89,04/30/2019
13420,VODKA,Stolichnaya Vanil Vodka,1L,165,28.99,,
70267,AMERICAN RED,Glen Carlou Rare Red Blend,750ML,0,14.49,,
417375,SOUTH AFRICA,Two Oceans Shiraz,1.5L,6,14.99,,
158690,FRANCE,Louis Sipp Pinot Blanc,750ML,0,15.49,,
300239,AMERICAN RED,Duckhorn Vineyards Decoy Cabernet Sauvignon,750ML,453,23.99,,
324727,SPAIN/PORTUGAL,Liquid Geography Mencia,750ML,14,12.99,,
29717,BEER,Alltech Kentucky Bourbon Barrel Stout - 4 Pack,12.0Z,300,14.99,,
38075,TEQUILA,1800 Reposado Reserva Tequila,750ML,475,25.99,,
11797,BOURBON/RYE,Jim Beam Kentucky Straight Bourbon Whiskey,200ML,939,5.99,,
82367,AMERICAN WHITE,Skyfall Vineyards Chardonnay,750ML,58,12.99,,
80160,ARGENTINA,Trapiche Malbec,750ML,180,7.99,,
76074,MISCELLANEOUS IMPORTED,Chum Churum Cool Soju,375ML,596,5.99,,
59323,BOURBON/RYE,1792 Ridgemont Reserve Barrel Select Kentucky Straight Bourbon Whiskey,750ML,235,29.99,,
332347,FRANCE,J MOURAT COLLECTION ROSE,750ML,0,16.49,,
41327,BRANDY/COGNAC/GRAPPA,St. Remy VSOP Brandy,750ML,279,14.49,,
99198,BEER,Modelo Especial - 12 Pack,12.0Z,1825,16.99,,
313577,FRANCE,Domaine De L'Auriere Muscadet Sevre et maine Sur Lie Melon de Bourgogne,750ML,3,14.39,,
97160,BEER,Taj Mahal Premium Lager Beer - 6 Pack,22.0Z,123,26.99,,
97969,BEER,Samuel Smith's Winter Welcome Ale - 4 Pack,12.0Z,4,12.99,,
39748,AUSTRALIA,The Little Penguin Merlot,1.5L,54,14.69,,
70529,TEQUILA,Jose Cuervo Tradicional Silver Tequila,750ML,116,18.69,,
43311,BOURBON/RYE,Sazerac 18 Year Old Kentucky Straight Rye Whiskey,750ML,0,99.99,,
80882,AMERICAN RED,Boordy Vineyards Chesapeake Icon No.4 Terrapin Petit Cab Cabernet Sauvignon,750ML,163,16.99,,
39713,CORDIALS,Brady's Irish Cream Liqueur,750ML,446,9.49,,
73668,CORDIALS,Gozio Amaretto Liqueur,750ML,29,21.99,,
342416,ITALY,"Varvaglione ""Papale"" Primitivo di Manduria",750ML,0,13.99,,
10210,BEER,Ninkasi Noir Milk Stout - 1 Pack,22.0Z,0,84.99,,
14702,FRANCE,Alain Jaume & Fils Domaine du Clos de Sixte Lirac Red Southern Rhone Blend,750ML,1,20.99,,
94862,BEER,Trappistes Rochefort 10 - 6 Pack,11.2Z,0,48.99,,
42842,GREECE,Samartzis Two Rivers Red Dry Merlot,750ML,0,13.99,,
12017,BOURBON/RYE,Old Forester Classic 86 Proof Kentucky Straight Bourbon Whisky,750ML,281,17.99,,
235720,OTHER WINE,CRICOVA CRISECCO SPUM BRUT   750ML,750ML,0,7.79,,
79553,CHAMPAGNE/SPARKLING,Andre Peach Moscato Muscat,750ML,123,7.59,,
36056,VODKA,Absolut Vodka,750ML,527,26.99,,
48217,BOURBON/RYE,Willett Pot Still Reserve Small Batch Kentucky Straight Bourbon Whiskey,1.75L,20,94.99,,
428574,AMERICAN RED,Tomasello Winery Blueberry Wine Red Blend,500ML,2,11.49,,
82301,AMERICAN TABLE,Gallo Family Vineyards / Gallo of Sonoma Sweet Berry Rose Blend,750ML,96,6.49,,
311939,SPAIN/PORTUGAL,Bodegas Juan Gil Honoro Vera Merlot,750ML,0,9.99,,
91960,BEER,Miller Lite Can - 12 Pack,24.0Z,0,27.99,,
71604,GIN,Seagram's Distiller's Reserve Gin,750ML,4,12.99,,
340744,ARGENTINA,Astica Syrah,750ML,0,6.79,,
83660,ITALY,Santa Margherita Riserva Chianti Classico Chianti Blend,750ML,44,23.99,,
70347,VODKA,Pinnacle Citrus Vodka,750ML,162,10.99,,
81811,AUSTRALIA,Yellow Tail Pinot Noir,1.5L,230,12.99,,
362069,ARGENTINA,Bodega & Vinedos San Polo Auka Malbec,750ML,0,12.99,,
304687,FRANCE,Domaine du Tariquet Rose de pressee Merlot,750ML,1,10.49,,
330384,SPAIN/PORTUGAL,Proyecto Garnachas De Espana Salvaje del Moncayo Garnacha,750ML,0,11.49,,
8257,BEER,Shiner Bock - 6 Pack,12.0Z,852,8.99,,
72326,TEQUILA,Milagro Silver Tequila,1.75L,91,53.99,,
333688,TEQUILA,Casamigos Anejo Tequila,750ML,161,55.99,,
82171,AMERICAN RED,Franzia Vintner Select Merlot,5LTR,191,19.99,,
239738,VODKA,Wheatley Vodka,750ML,151,19.99,,
44493,AMERICAN RED,Orin Swift Papillon Bordeaux Blend,750ML,78,62.99,,
335735,RUM,Picaroon White Rum,750ML,124,38.99,,
50652,RUM,Rhum Barbancourt 5 Star 8 Year Old Reserve Speciale Rum,750ML,255,25.99,21.99,04/30/2019
10545,AMERICAN RED,Ferrari Carano Merlot,750ML,54,24.99,,
32018,GIN,Beefeater London Dry Gin,750ML,411,17.99,15.99,04/30/2019
72756,BOURBON/RYE,Southern Comfort Liqueur 80 Proof,750ML,81,13.99,,
165492,RUM,Wray & Nephew White Overproof Rum,375ML,52,9.99,,
44752,GERMANY,MELSHEIMER RIES QBA,750ML,0,17.49,,
74225,AMERICAN RED,Manischewitz Kosher for Passover Concord,3L,102,14.99,,
74519,GREECE,Achaia Clauss Demestica Red Agiorgitiko,750ML,4,12.49,,
78960,CANADIAN/BLENDED WHISKEY,Twin Valley Single Barrel Corn Whiskey,750ML,6,31.99,,
10818,BEER,Port City Optimal Wit - 4 Pack,16.0Z,0,8.99,,
24453,BEER,Full Sail Amber Ale - 6 Pack,12.0Z,0,12.99,,
99171,BEER,Tecate Cerveza Can,24.0Z,0,2.99,,
92886,BEER,Coors Light - 12 Pack,12.0Z,375,12.99,,
310955,AMERICAN TABLE,Mu Creamy Espresso Macchiato,50ML,14,1.19,,
27356,BEER,Strongbow Gold Apple Hard Cider - 6 Pack,11.2Z,606,9.99,,
27120,SCOTCH,Clan MacGregor Blended Scotch Whisky,1.75L,254,21.99,17.99,04/30/2019
79369,GIN,Seagram's Pineapple Twisted Gin,750ML,7,13.99,,
29731,BEER,Anderson Valley Blood Orange Gose - 6 Pack,12.0Z,0,13.99,,
305523,FRANCE,Chateau de Bon Ami Bordeaux Blend,750ML,105,9.79,,
10529,MIXERS,Jose Cuervo Golden Margarita,1.75L,235,19.49,,
337590,AMERICAN WHITE,Tortoise Creek Wines Jam's Blend Chardonnay,750ML,0,12.99,,
333483,AMERICAN RED,Bears' Lair Pinot Noir,750ML,0,8.99,,
86667,AMERICAN RED,Red Rock Reserve Merlot,750ML,150,11.49,8.99,04/30/2019
81767,AUSTRALIA,Yellow Tail Sauvignon Blanc,1.5L,227,12.99,,
50676,BEER,Seagram's Escapes Ocean City Crush - 4 Pack,11.2Z,52,4.99,,
96423,BEER,Amstel Light - 12 Pack,12.0Z,1416,16.99,,
43725,AMERICAN RED,Prisoner Wine Company The Prisoner Zinfandel,750ML,149,45.99,,
145837,FRANCE,Chateau d'Esclans Whispering Angel Rose Cotes de Provence Rare Rose Blend,375ML,89,11.69,,
53112,GERMANY,Schmitt Sohne Relax Riesling,750ML,400,10.49,,
26249,BEER,Bud Light Lime Straw Ber Rita Can,25.0Z,53,2.99,,
80372,BRANDY/COGNAC/GRAPPA,Park VS Carte Blanche Cognac,750ML,65,35.99,,
336196,ITALY,Ca' Marcanda (Gaja) Promis Toscana IGT Merlot,750ML,12,51.99,,
98167,BEER,Beck's Pils - 6 Pack,12.0Z,1284,8.99,,
336865,AMERICAN RED,Josh Cellars Legacy Rare Red Blend,750ML,347,14.49,13.99,04/30/2019
81280,AMERICAN RED,Pepperwood Grove Pinot Noir,750ML,100,7.79,,
71126,MIXERS,1800 The Ultimate Pineapple Margarita,1.75L,172,18.49,16.99,04/30/2019
166257,FRANCE,Domaine des Caves du Prieure Sancerre Sauvignon Blanc,375ML,3,12.39,,
306226,AMERICAN RED,Line 39 Cabernet Sauvignon,750ML,0,11.99,,
359653,PORT/SHERRY/DESSERT/VERMOUTH,Cantine Riondo Spago Nero Prosecco Glera,750ML,255,11.99,,
301283,OTHER WINE,Dewatsuru Kimoto Junmai Sake,1.8L,0,44.99,,
75060,FRANCE,Maison Nicolas Ferrande Sauvignon Blanc,750ML,54,7.49,,
25980,BEER,Flying Dog Snake Dog IPA - 12 Pack,12.0Z,203,19.99,,
26327,BEER,Left Coast Hop Juice Double IPA - 4 Pack,12.0Z,0,12.99,,
70463,BRANDY/COGNAC/GRAPPA,Hartley VSOP Brandy,750ML,0,8.99,,
305127,FRANCE,Louis Laurent Vouvray Chenin Blanc,750ML,0,9.79,,
41347,GERMANY,S.A. Prum Essence Riesling,750ML,20,14.39,,
24443,BEER,21st Amendment Fireside Chat - 6 Pack,12.0Z,0,11.99,,
327101,GREECE,MANOLESAKIS SYR,750ML,0,17.99,,
35149,VODKA,Smirnoff Silver Vodka 90 Proof,750ML,35,13.99,,
98248,BEER,Brouwerij de Regenboog Vuuve - 6 Pack,11.2Z,0,31.99,,
27061,BEER,RJ Rockers Good Boy Stout  - 4 Pack,12.0Z,0,7.99,,
29783,BEER,TERRAPIN IPA SURVIVAL KIT   2/12 CANS - 12 Pack,12.0Z,204,18.99,,
80256,KOSHER,Hagafen Late Harvest Sauvignon Blanc,375ML,6,27.99,,
17825,TEQUILA,Don Julio 1942 Anejo Tequila,750ML,116,105.99,,
301258,SPAIN/PORTUGAL,Codorniu Anna de Codorniu Brut Chardonnay,750ML,25,12.99,,
45454,AMERICAN RED,Edmeades Winery Zinfandel,750ML,118,17.99,,
86541,AMERICAN RED,Gallo Family Vineyards / Gallo of Sonoma Cabernet Sauvignon,1.5L,159,10.49,,
73696,SCOTCH,The Balvenie 30 Year Old Single Malt Scotch Whisky,750ML,14,1046.99,,
322824,BOURBON/RYE,Rough Rider Double Casked Straight Bourbon Whisky,750ML,44,36.99,,
80948,AMERICAN TABLE,Gallo Family Vineyards / Gallo of Sonoma Sweet Peach Rose Blend,1.5L,11,10.49,,
80856,MIXERS,Stirrings Dirty Martini Mix,12.0Z,9,4.79,,
23432,BEER,Pabst Blue Ribbon Can - 30 Pack,12.0Z,72,21.99,,
25944,BEER,Hofbrau Oktoberfestbier - 6 Pack,11.2Z,12,10.99,,
70716,MISCELLANEOUS IMPORTED,Brenne Estate Cask French Single Malt Whisky,750ML,79,67.99,,
66257,ITALY,Danzante Delle Venezie IGT Pinot Grigio,750ML,41,11.49,,
24180,RUM,Brugal Rum Anejo Superior,1.75L,150,35.99,31.99,04/30/2019
54526,CHAMPAGNE/SPARKLING,Francis Ford Coppola Sofia Mini Blanc de Blancs Rare White Blend - 4 Pack,187ML,242,18.36,,
322177,KOSHER,Recanati Yasmin White Rare White Blend,750ML,19,14.69,,
17868,AMERICAN TABLE,Linganore Winecellars White Raven Estate Bottled Pinot Grigio,750ML,127,12.49,,
341290,FRANCE,Chateau Gaudrelle Alexandre Monmousseau Clos Le Vigneau Vouvray Chenin Blanc,750ML,0,16.49,,
332919,AMERICAN RED,Joel Gott Pinot Noir,750ML,4,19.99,,
188522,AUSTRALIA,Cape Mentelle Sauvignon Blanc,750ML,21,14.99,,
56952,SCOTCH,McClelland's Islay Single Malt Scotch Whisky,1.75L,92,46.99,,
76631,SCOTCH,Johnnie Walker Gold Label Reserve Blended Scotch Whisky,750ML,80,63.99,55.99,04/30/2019
332576,CHAMPAGNE/SPARKLING,Perrier Jouet Blason Rose Champagne Rose,750ML,0,85.99,,
350756,BOURBON/RYE,Sagamore Spirit Double Oak Straight Rye Whiskey,750ML,69,48.99,,
311356,VODKA,Vdka 6100 Vodka,750ML,73,29.99,,
306252,AMERICAN WHITE,Rex Goliath Free Range Giant 47 Pound Rooster Sauvignon Blanc,750ML,0,7.79,,
32026,GIN,Bombay Dry Gin,1.75L,322,31.99,26.99,04/30/2019
235312,OTHER WINE,Els Iced Chocolate,750ML,64,12.69,,
50664,BEER,Corona Premier Can - 12 Pack,12.0Z,132,18.99,,
97462,BEER,Ayinger Celebrator - 6 Pack,11.2Z,0,78.99,,
28806,BEER,Wittekerke Framboise - 6 Pack,11.2Z,0,18.99,,
319152,FRANCE,Domaine Lafage Bastide Miraflors Vieilles Vignes Syrah,750ML,0,15.99,,
333449,AMERICAN WHITE,Kendall Jackson Vintner's Reserve Pinot Gris,750ML,244,14.49,11.99,04/30/2019
72026,MIXERS,Bacardi Classic Cocktails Rum Punch,1.75L,31,23.99,,
328899,BOURBON/RYE,Catoctin Creek Roundstone Distiller's Edition Rye Whiskey,750ML,16,58.99,,
61034,BEER,Dogfish Head 90 Minute Imperial IPA - 6 Pack,12.0Z,1513,12.99,,
27146,SCOTCH,Glenmorangie The Original 10 Year Old Highland Single Malt Scotch Whisky,750ML,328,41.99,,
316774,FRANCE,Cave de Roquebrun Terrasses du Frigoulet Languedoc Red Blend,750ML,0,12.99,,
349658,CHILE,Miguel Torres Santa Digna Rose Reserva Cabernet Sauvignon,750ML,0,14.69,,
23181,BEER,Miller Lite - 24 Pack,12.0Z,4,29.99,,
341251,FRANCE,Chateau Haut Barade Petit Verdot,750ML,0,12.99,,
76288,VODKA,New Amsterdam Vodka,50ML,2431,1.29,,
80124,AMERICAN WHITE,Entwine Pinot Grigio,750ML,94,10.49,,
70238,TEQUILA,1800 Reposado Reserva Tequila,1.75L,270,40.99,,
48548,BRANDY/COGNAC/GRAPPA,Bistra Slivovitz Serbian Plum Brandy,750ML,61,17.99,,
333095,SOUTH AFRICA,Mvemve Raats MR de Compostella Bordeaux Blend,750ML,3,67.99,,
27448,SCOTCH,McClelland's Highland Single Malt Scotch Whisky,750ML,197,19.99,,
84301,AMERICAN WHITE,Sutter Home Winery Sauvignon Blanc,187ML,1158,1.89,,
338503,FRANCE,Maison de la Villette Chardonnay,750ML,93,12.69,,
79120,CHAMPAGNE/SPARKLING,Tosti Dolce Asti Muscat Blanc a Petits Grains,750ML,41,11.49,,
28916,VODKA,Absolut Apeach Vodka,1L,38,30.99,,
106577,ITALY,Feudi di San Gregorio Falanghina del Sannio,750ML,0,16.99,,
71385,MIXERS,1800 Ultimate Margarita,1.75L,199,18.49,16.99,04/30/2019
313885,AMERICAN RED,Folie a Deux Menage a Trois Cabernet Sauvignon,750ML,124,12.99,,
124796,ITALY,Produttori del Barbaresco Barbaresco DOCG Nebbiolo,750ML,0,50.99,,
708978,SCOTCH,Glenfiddich 14 Year Old Bourbon Barrel Reserve Single Malt Scotch Whisky,750ML,300,47.99,,
56936,AMERICAN RED,Carmel Road Pinot Noir,750ML,332,19.99,15.99,04/30/2019
41435,AMERICAN RED,Capriccio Bubbly Sangria Red Blend,375ML,603,3.19,,
31658,NEW ZEALAND,Kim Crawford Unoaked Chardonnay,750ML,195,16.49,,
336644,ITALY,Cantine Monfort Terre del Fohn Trentino Pinot Grigio,750ML,2,12.99,,
341405,KOSHER,Mt. Tabor Gewurztraminer,750ML,0,13.99,,
79183,CANADIAN/BLENDED WHISKEY,Canadian LTD Blended Canadian Whisky,1.75L,0,13.49,,
83635,AUSTRALIA,Fisheye Pinot Noir,750ML,75,5.79,,
330261,ARGENTINA,Layer Cake Sea of Stones One Hundred Percent Hand Crafted Malbec,750ML,146,15.99,,
312851,ITALY,Wilhelm Walch Prendo Alto Adige   Sudtirol Pinot Noir,750ML,0,14.39,,
48720,FRANCE,Pascal Jolivet Sancerre Sauvignon Blanc,750ML,0,26.99,,
232820,AMERICAN BLUSH/ROSE,Cambria Rose Julia's Vineyard Pinot Noir,750ML,34,25.99,,
29489,BEER,BOLD ROCK VARIETY CRATE 2/12 NR - 12 Pack,12.0Z,120,18.99,,
65684,ITALY,Bolla Delle Venezie IGT Pinot Grigio,1.5L,99,16.49,,
328061,GREECE,Zoinos S.A. White Z Zed Debina,750ML,0,12.69,,
300586,ITALY,Livio Felluga Colli Orientali del Friuli Pinot Grigio,750ML,0,30.99,,
29200,BEER,KAPITTEL SAMPLER PACK   4/6 NR - 4 Pack,11.2Z,0,17.99,,
76309,AMERICAN BLUSH/ROSE,Barefoot Cellars White Zinfandel,1.5L,170,15.49,,
47479,AMERICAN WHITE,Stony Hill Chardonnay,750ML,0,56.99,,
71854,BOURBON/RYE,Wild Turkey Kentucky Spirit Single Barrel Kentucky Straight Bourbon Whiskey,750ML,16,52.99,,
11618,AMERICAN RED,La Catrina Sangria Rare Red Blend,750ML,0,12.99,,
335504,ITALY,Castello Banfi Centine Toscana IGT Sangiovese,5L,0,92.99,,
60003,FRANCE,Cave de Lugny Les Charmes Macon Lugny Chardonnay,750ML,364,15.99,,
57827,AMERICAN RED,Sterling Vineyards SVR Reserve Bordeaux Blend,750ML,0,44.99,,
78734,CANADIAN/BLENDED WHISKEY,Jack Daniel's Tennessee Honey Liqueur,1.75L,313,44.99,38.99,04/30/2019
35262,VODKA,Smirnoff Vodka 100 Proof,750ML,104,15.49,,
21563,AUSTRALIA,Fisheye Pinot Grigio,750ML,232,5.79,,
72113,CHILE,Chilensis Reserva Estate Bottled Sauvignon Blanc,750ML,21,11.99,,
310357,AMERICAN WHITE,NxNW The Explorer Series Riesling,750ML,3,12.99,,
84592,CHAMPAGNE/SPARKLING,Risata Pink Moscato Muscat,750ML,161,14.99,,
306841,AMERICAN RED,Dante Reserve Pinot Noir,750ML,9,10.49,,
14249,AMERICAN RED,Smoking Loon The Original Pinot Noir,750ML,157,11.49,,
28053,SCOTCH,Inver House Green Plaid Very Rare Blended Scotch Whisky,1.75L,193,19.99,,
10908,VODKA,Sloop Betty Honey Vodka,750ML,65,35.99,,
417076,ITALY,Villa Jolanda Moscato D'Asti DOCG Muscat Blanc a Petits Grains,750ML,128,14.69,,
68276,PORT/SHERRY/DESSERT/VERMOUTH,Hartley & Gibson's Fino Very Dry Sherry Palomino,750ML,116,11.99,,
84576,CHILE,Veramonte Cabernet Sauvignon,750ML,0,10.99,,
45844,AMERICAN RED,Flora Springs Trilogy Bordeaux Blend,750ML,0,82.99,,
81300,AMERICAN RED,Carlo Rossi Sweet Red Blend,1.5L,76,7.99,,
93491,BEER,Xingu Black Beer - 6 Pack,12.0Z,36,15.99,,
19860,AMERICAN RED,Turning Leaf Merlot,1.5L,174,15.49,,
10427,BEER,Clown Shoes American Monastic - 4 Pack,12.0Z,0,11.99,,
82163,AMERICAN RED,Clos du Bois Hand Selected Lots Merlot,750ML,340,15.49,12.99,04/30/2019
81884,AMERICAN WHITE,Franzia Refreshing White Rare White Blend,5L,162,15.99,,
14400,GIN,Broker's London Dry Gin,750ML,2,26.99,,
341007,SPAIN/PORTUGAL,Ego Bodegas Fuerza Monastrell,750ML,155,14.99,13.99,04/30/2019
43270,CORDIALS,Jinro Chamisul Fresh Soju,375ML,768,6.39,,
72580,MIXERS,Margaritaville Classic Margarita Ready to Drink,1.75L,101,15.49,12.99,04/30/2019
83986,CHAMPAGNE/SPARKLING,Perelada Brut Reserva Cava Blend,750ML,0,11.99,,
83627,AMERICAN WHITE,Bota Box Sauvignon Blanc,3L,242,23.99,18.99,04/30/2019
71607,BOURBON/RYE,Colonel E.H. Taylor Jr. Small Batch Kentucky Straight Bourbon Whiskey,750ML,0,39.99,,
46138,RUM,The Kraken Black Spiced Rum 94 Proof,750ML,310,18.99,15.99,04/30/2019
86134,KOSHER,Herzog Chardonnay,750ML,185,11.39,,
27854,BEER,Straffe Hendrik Tripel - 4 Pack,11.2Z,0,23.99,,
350092,OTHER WINE,Rough Day Rose Cabernet Sauvignon,750ML,124,8.99,,
62993,BEER,VICTORY WHITE MONKEY 12/500ML,500ML,40,8.99,,
47160,TEQUILA,Sombra Mezcal,750ML,78,37.99,,
70604,BEER,TRULY SPIKED & SPARKLING CITRUS VARIETY 12PK 12 0ZCAN - 12 Pack,12.0Z,1218,17.48,,
47300,ITALY,Sartori di Verona Ferdi Verona IGT Garganega,750ML,0,16.99,,
91340,BEER,Maredsous 10 Tripel - 6 Pack,11.2Z,0,28.99,,
93041,BEER,Anderson Valley Hop Ottin' IPA - 6 Pack,12.0Z,0,14.99,,
308019,AMERICAN RED,Mad Housewife Besitos   Sweet Red Rare Red Blend,750ML,0,13.49,,
342706,FRANCE,Husch Vineyards Estate Bottled Chardonnay,750ML,0,17.49,,
10439,AMERICAN RED,Concannon Vineyard Cabernet Sauvignon,750ML,34,15.49,,
325236,KOSHER,Herzog Jeunesse Semi Sweet Cabernet Sauvignon,750ML,0,11.39,,
324403,AMERICAN WHITE,Domaines Paul Mas la Madeleine Chardonnay,750ML,0,10.99,,
317608,SPAIN/PORTUGAL,Dominio de Eguren Protocolo Blanco Macabeo,750ML,39,7.99,,
336727,VODKA,St. George California Citrus Vodka,750ML,4,30.99,,
19267,CHAMPAGNE/SPARKLING,Louis Roederer Cristal Brut Champagne Brut,750ML,14,269.99,,
92568,BEER,Harpoon IPA - 6 Pack,12.0Z,366,9.99,,
306490,AMERICAN WHITE,Geyser Peak Pinot Grigio,750ML,12,10.99,,
26947,BEER,Crabbie's Spiced Orange Alcoholic Ginger Beer - 4 Pack,11.2Z,0,11.99,,
10853,VODKA,Absolut Citron Vodka,375ML,16,13.99,,
84174,AMERICAN BLUSH/ROSE,Sutter Home Winery The Original White Zinfandel,187ML,748,1.89,,
80295,PORT/SHERRY/DESSERT/VERMOUTH,Lillet Rose Semillon,750ML,74,18.99,,
47105,BRANDY/COGNAC/GRAPPA,Lechaim Kosher XO Brandy,750ML,0,30.99,,
41551,CORDIALS,Askalon Extra Fine Special Arak 100 Proof,750ML,8,16.49,,
33332,VODKA,Belvedere Vodka,750ML,219,31.99,,
331536,ITALY,Castelli Martinozzi Brunello di Montalcino DOCG Sangiovese,750ML,0,45.99,,
304164,AMERICAN RED,Murrieta's Well The Spur Bordeaux Blend,750ML,20,25.99,,
143294,FRANCE,Chateau des Leotins Merlot,750ML,58,9.79,,
71265,RUM,Smith & Cross Traditional Jamaica Rum,750ML,12,34.99,,
80046,AMERICAN WHITE,Middle Sister Sweet & Sassy Moscato Muscat,750ML,113,10.99,,
84409,AMERICAN TABLE,LIvingston Cellars Burgundy Pinot Noir,1.5L,71,7.99,,
304627,ARGENTINA,Familia Zuccardi Santa Julia [+] Malbec,750ML,102,10.49,,
70787,BOURBON/RYE,Rock Creek White Whiskey,750ML,0,34.99,,
27219,SCOTCH,White Horse Fine Old Blended Scotch Whisky,750ML,72,17.49,,
342149,TEQUILA,Avion Reposado Tequila,50ML,130,4.39,,
58270,VODKA,Three Olives Grape Vodka,750ML,66,16.99,,
428515,AMERICAN RED,Tomasello Winery Cherry Wine Red Blend,500ML,0,10.99,,
70767,CORDIALS,RumChata Horchata Con Ron Cream Liqueur,750ML,266,24.99,,
93602,BEER,Miller High Life - 12 Pack,12.0Z,120,10.99,,
310172,CHILE,La Playa Estate Series Rose Cabernet Sauvignon,750ML,0,8.19,,
25613,BEER,Smirnoff Ice Screwdriver - 6 Pack,11.2Z,102,8.99,,
74853,CORDIALS,Goldschlager Cinnamon Schnapps,50ML,205,2.99,,
342410,PORT/SHERRY/DESSERT/VERMOUTH,Santa Sofia Amarone della Valpolicella Classico DOCG Valpolicella Blend,750ML,0,40.99,,
55247,AMERICAN RED,Erath Pinot Noir,750ML,351,18.49,,
327239,CHAMPAGNE/SPARKLING,Vega Barcelona Brut Seleccion Cava Blend,750ML,0,10.99,,
26023,BEER,Sierra Nevada Narwhal Imperial Stout - 6 Pack,12.0Z,36,12.99,,
22123,BEER,Julius Echter Hefe Weissbier Hell - 4 Pack,16.9Z,0,16.99,,
437654,AMERICAN WHITE,Husch Vineyards Chenin Blanc,750ML,0,15.49,,
27958,BEER,Abita Lemon Wheat - 6 Pack,12.0Z,0,11.99,,
96016,BEER,Bass Pale Ale - 6 Pack,12.0Z,126,9.99,,
69443,NEW ZEALAND,13 Celsius Vineyards 13 Celsius Sauvignon Blanc,750ML,410,13.99,,
70717,MIXERS,Master of Mixes Pina Colada Mix,1.75L,123,5.59,,
335983,ITALY,Argiolas Turriga Isola Dei Nuraghi IGT Cannonau,750ML,2,83.99,,
89893,AMERICAN BLUSH/ROSE,Vendange Wine Cellars White Zinfandel,1.5L,79,10.49,,
85078,AMERICAN BLUSH/ROSE,Beringer Vineyards Main & Vine Pink Moscato Muscat,1.5L,203,13.99,10.99,04/30/2019
79618,PORT/SHERRY/DESSERT/VERMOUTH,Martini & Rossi Vermouth Extra Dry White Blend,1.5L,210,19.39,,
334184,SPAIN/PORTUGAL,Casa Agricola Alexandre Relvas Merino Old Vines Aragonez,750ML,108,8.59,,
50716,BEER,Milwaukee's Best Lager Can - 15 Pack,12.0Z,195,8.99,,
32077,GIN,Tanqueray London Dry Gin,750ML,694,22.99,18.99,04/30/2019
29941,BEER,Queen Bohemian Lager - 1 Pack,11.2Z,0,62.99,,
70437,IRISH WHISKEY,Donegal Estates Irish Whiskey,750ML,91,28.99,,
334970,ITALY,Fiore Wine Collection di Alessandro Fiore Fiore Nero Chianti DOCG Chianti Blend,750ML,0,11.49,,
74403,ARGENTINA,Terrazas de Los Andes Altos del Plata Cabernet Sauvignon,750ML,57,11.49,,
95788,BEER,Amstel Light - 12 Pack,12.0Z,345,18.99,,
84373,FRANCE,Chateau Ferrand Pomerol Bordeaux Blend,750ML,45,28.99,,
35220,VODKA,Smirnoff Twist Of Citrus Vodka,50ML,3523,0.99,,
40947,FRANCE,Domaine Andre Brunel Cotes du Rhone Red Southern Rhone Blend,750ML,17,17.99,,
24546,CHILE,Concha y Toro Frontera Chardonnay,187ML,11,1.79,,
345549,AMERICAN WHITE,Bon Anno Chardonnay,750ML,1,25.99,,
73288,AMERICAN RED,De Loach Merlot,750ML,0,19.69,,
312009,OTHER WINE,Bon Appetit Cabernet Sauvignon,750ML,0,5.79,,
70560,SCOTCH,Highland Queen Blended Scotch Whisky,750ML,3,16.49,,
41033,BRANDY/COGNAC/GRAPPA,Hennessy V.S Cognac,1L,656,47.99,,
83912,AMERICAN RED,Barefoot Cellars Pinot Noir,1.5L,234,15.49,,
311327,AMERICAN WHITE,Black Box Pinot Grigio,500ML,156,5.49,,
11535,BEER,Stone Go To IPA - 6 Pack,16.0Z,36,10.99,,
383430,AMERICAN RED,The Magnificent Wine Company Steak House Cabernet Sauvignon,750ML,66,11.99,,
84828,PORT/SHERRY/DESSERT/VERMOUTH,Taylor (Fladgate) Very Old Single Harvest Porto Limited Edition Red Port,750ML,0,229.99,,
68470,PORT/SHERRY/DESSERT/VERMOUTH,Presidential Ruby Red Port,750ML,153,13.69,,
27431,BEER,Original Sin Cherry Tree Cider - 4 Pack,12.0Z,0,11.99,,
92932,BEER,Erdinger Wei�bier - 6 Pack,12.0Z,0,13.99,,
5606,BEER,Menabrea Birra Leggera Bionda - 6 Pack,11.2Z,0,13.99,,
99766,BEER,Sterkens St. Paul Double - 6 Pack,12.0Z,0,23.99,,
334360,ITALY,Azienda Agricola Angelini Colli Pesaresi Sangiovese,750ML,19,16.49,,
70404,GIN,Bulldog London Dry Gin,750ML,35,22.99,,
80900,PORT/SHERRY/DESSERT/VERMOUTH,Taylor Wine Company Cream Sherry,750ML,184,6.99,,
40223,BRANDY/COGNAC/GRAPPA,Christian Brothers VS Brandy,750ML,292,10.49,,
11843,BOURBON/RYE,Kentucky Gentleman Kentucky Bourbon Whiskey,750ML,353,7.69,,
71106,TEQUILA,Patron Anejo Tequila,1.75L,30,139.99,,
50690,BEER,Estrella Jalisco - 6 Pack,12.0Z,60,9.99,,
85772,AMERICAN RED,The Naked Grape Cabernet Sauvignon,3L,91,19.99,16.99,04/30/2019
313556,AMERICAN WHITE,Vendange Wine Cellars Chardonnay,500ML,16,4.99,,
166520,AMERICAN TABLE,Daily's Pina Colada Frozen Pouch Cocktail,10OZ,154,1.99,,
58459,NEW ZEALAND,Drylands Sauvignon Blanc,750ML,15,19.99,,
79081,CHAMPAGNE/SPARKLING,Martini & Rossi Asti Muscat Blanc a Petits Grains,750ML,416,15.99,,
309843,SPAIN/PORTUGAL,Bodegas Breca Garnacha de Fuego Old Vines Grenache,750ML,101,10.99,,
40338,AMERICAN RED,Cline Cellars Ancient Vines Zinfandel,750ML,86,17.49,,
422304,NEW ZEALAND,Kim Crawford Sauvignon Blanc,375ML,69,10.99,,
40169,BRANDY/COGNAC/GRAPPA,Christian Brothers VS Brandy,1L,228,12.99,,
316031,FRANCE,Villa Dria Rare White Blend,750ML,0,8.99,,
232138,AMERICAN RED,Michael David Vineyards Freakshow Red Rare Red Blend,750ML,55,21.99,,
74789,SPECIALTY,Bullshine Peach Flavored Whiskey,750ML,91,29.99,,
80578,AMERICAN BLUSH/ROSE,Sutter Home Winery White Merlot,187ML,667,1.89,,
333331,KOSHER,J. Fernandez de Arcaya Galdiano Alate Kosher Tempranillo,750ML,0,16.99,,
80389,CHILE,TerraNoble Cabernet Sauvignon,750ML,12,10.49,,
44039,VODKA,Svedka Vodka,1L,359,14.49,,
328963,ITALY,Cantina Montelliana Extra Dry Prosecco di Treviso Glera,750ML,15,11.39,,
71505,CORDIALS,Caffo Limoncino Liqueur,750ML,143,13.99,,
84089,CHAMPAGNE/SPARKLING,Korbel Brut California Champagne Methode Champenoise White Blend,750ML,289,16.99,,
10637,CHAMPAGNE/SPARKLING,Cupcake Vineyards Prosecco Glera - 3 Pack,187ML,258,13.77,,
26034,NEW ZEALAND,Monkey Bay Sauvignon Blanc,750ML,354,10.49,8.99,04/30/2019
43146,NEW ZEALAND,Lawson's Dry Hills Reserve Pinot Noir,750ML,0,24.99,,
23345,AMERICAN RED,Linganore Winecellars Black Raven Red Blend,750ML,8,13.49,,
312845,SPAIN/PORTUGAL,Cruzeiro Dos Arcos Branco White Blend,750ML,2,7.99,,
342769,ITALY,Caposaldo Chianti DOCG Chianti Blend,750ML,0,10.99,,
70415,GIN,New Deal 33 Portland Dry Gin,750ML,0,31.99,,
71761,VODKA,New Amsterdam Orange Vodka,750ML,20,11.99,,
68179,ASIA,Sho Chiku Bai Classic Junmai Sake,18L,3,89.99,,
316692,CORDIALS,Prichard's Cranberry Rum,750ML,4,29.99,,
73578,VODKA,Burnett's Whipped Cream Vodka,750ML,2,7.69,,
325205,VODKA,Fair Quinoa Vodka,750ML,12,27.99,,
6947,BEER,Obolon Oksamytove Beer - 4 Pack,16.9Z,0,11.99,,
50201,BEER,Sly Fox 360 IPA - 4 Pack,16.0Z,0,8.99,,
23369,BEER,R.J. Rockers Son of a Peach - 6 Pack,12.0Z,0,11.99,,
345523,AMERICAN RED,Sutter Home Winery Cabernet Sauvignon,500ML,0,5.49,,
312280,BOURBON/RYE,Reservoir Bourbon Whiskey,750ML,10,102.99,,
345828,KOSHER,Elvi Wines Vina Encina Blanco Rare White Blend,750ML,3,9.99,,
76260,AMERICAN RED,Barefoot Cellars Cabernet Sauvignon,1.5L,300,15.49,,
93190,BEER,Dundee Original Honey Brown Lager - 6 Pack,12.0Z,678,5.99,,
39225,BEER,Erdinger Oktoberfest - 6 Pack,11.2Z,0,13.99,,
73652,AUSTRALIA,Penfolds Rawson's Retreat Shiraz,750ML,110,8.99,,
31109,BEER,Dogfish Head 60 Minute IPA Can - 12 Pack,12.0Z,852,18.99,,
322198,AMERICAN RED,Erath Estate Selection Pinot Noir,750ML,42,42.99,,
239702,GIN,Monkey 47 Schwarzwald Dry Gin,1L,22,60.99,,
26638,BOURBON/RYE,George Dickel No.12 Sour Mash Tennessee Whisky,750ML,131,23.99,,
27413,SCOTCH,Dewar's White Label Blended Scotch Whisky,375ML,330,16.49,,
22320,BEER,Abita Strawberry Lager - 6 Pack,12.0Z,0,11.99,,
50757,BEER,Budweiser Reserve Copper Lager  - 6 Pack,12.0Z,146,8.99,,
43606,SPAIN/PORTUGAL,Palacios Remondo La Montesa Crianza Garnacha,750ML,0,19.99,,
84583,NEW ZEALAND,Brancott Estate Flight Song Sauvignon Blanc,750ML,171,14.99,,
311348,BRANDY/COGNAC/GRAPPA,Maxime VSOP Trijol Cognac,750ML,7,37.99,,
27383,SCOTCH,Duggan's Dew Blended Scotch Whisky,1.75L,141,24.99,,
94978,BEER,Clausthaler Original Non Alcoholic - 6 Pack,12.0Z,-24,10.99,,
24226,BEER,Konig Pilsener Can - 4 Pack,16.9Z,0,6.99,,
84961,AMERICAN RED,Carnivor Cabernet Sauvignon,750ML,532,12.49,,
17256,SCOTCH,Old Pulteney 12 Year Old Single Malt Scotch Whisky,750ML,33,38.99,,
