Code,Category,Description,Size,Total Inventory,Price,Sale Price,Sale End Date
25654,BEER,UNIBROUE SOMMELIER SAMPLER 4/6 - 6 Pack,12.0Z,30,15.99,,
399809,GERMANY,Sun Garden Gewurztraminer,750ML,1,12.49,,
374504,AMERICAN RED,Greystone Cellars Cabernet Sauvignon,750ML,5,11.49,,
342596,SPAIN/PORTUGAL,Bodegas Navalon Anciano Reserva   Aged 7 Years Tempranillo,1.5L,11,13.99,,
313867,NEW ZEALAND,Fernlands Sauvignon Blanc,750ML,80,10.99,,
44628,RUM,Stroh 160 Spiced Rum,750ML,2,27.99,,
234020,OTHER WINE,Rough Day Chardonnay,750ML,73,9.99,,
43338,AMERICAN RED,Spellbound Petite Sirah,750ML,47,17.49,,
82788,AMERICAN RED,Sterling Vineyards Vintner's Collection Dark Red Blend,750ML,14,16.49,,
77780,SOUTH AFRICA,Fleur du Cap Pinotage,750ML,22,13.49,,
48663,VODKA,Skinnygirl Sweet 'n Tart Grapefruit Margarita,750ML,39,12.49,,
36863,BEER,Shiner Bock Can - 12 Pack,12.0Z,0,18.99,,
332873,PORT/SHERRY/DESSERT/VERMOUTH,Armenia Wine Pomegranate Semi Sweet Areni Noir,750ML,4,19.49,,
10308,BEER,St. Peter's Dirty Tackle,16.9Z,0,5.99,,
44225,OTHER WINE,"Massaya Silver Selection Cinsault, Cabernet Sauvignon, Grenache, Mourvedre",750ML,0,19.99,,
10440,AMERICAN WHITE,Concannon Vineyard Chardonnay,750ML,11,15.49,,
360449,ARGENTINA,Familia Mayol Single Vineyard Malbec,750ML,0,15.49,,
24096,BEER,Harviestoun Ola Dubh 16 Year Old Special Reserve,11.2Z,0,9.99,,
307283,ITALY,Carletto Delle Venezie IGT Pinot Grigio,750ML,6,8.99,,
93173,BEER,Daleside Morocco Ale,16.9Z,0,4.99,,
50091,CORDIALS,Carolans Irish Cream Liqueur,750ML,209,13.99,12.69,04/30/2019
333504,AMERICAN WHITE,Peter Michael L'Apres Midi Sauvignon Blanc,750ML,7,70.99,,
62383,BEER,Troegs Nugget Nectar Ale Can - 12 Pack,12.0Z,132,23.99,,
10616,BEER,Lambickx Private Domain Kriek,750ML,0,26.99,,
73881,CHILE,Calina Reserva Cabernet Sauvignon,750ML,0,10.99,,
305594,SPAIN/PORTUGAL,Bodegas Borsao Vina Borgia Grenache,3L,0,19.69,,
346652,FRANCE,Chateau la Commanderie de Gombeau Merlot,750ML,0,11.69,,
351873,NEW ZEALAND,Spy Valley Pinot Noir,750ML,0,27.99,,
12885,BEER,Port City Integral IPA - 6 Pack,12.0Z,60,11.99,,
305883,ITALY,Vini Casalbordino Impero Collection Terre di Chieti IGT Sangiovese,750ML,0,7.99,,
27505,BEER,Perennial Regalia,750ML,0,16.99,,
28836,BEER,Andechser Weissbier Hell,16.9Z,0,3.99,,
98744,BEER,Stella Artois Lager - 6 Pack,11.2Z,1,10.99,,
86059,AMERICAN RED,Gallo Family Vineyards / Gallo of Sonoma Signature Series Cabernet Sauvignon,750ML,45,39.99,,
306724,FRANCE,Les Cailloux (Lucien et Andre Brunel) Blanc Chateauneuf du pape White Southern Rhone Blend,750ML,0,52.99,,
83445,AMERICAN BLUSH/ROSE,Elk Run Sweet Katherine Cabernet Sauvignon,500ML,100,16.49,,
342225,AMERICAN WHITE,Pepperwood Grove Chardonnay,3L,0,20.99,,
50202,CORDIALS,Goldschlager Cinnamon Schnapps,750ML,153,22.99,,
28550,AMERICAN WHITE,Dry Creek Vineyard Dry Chenin Blanc,750ML,12,14.99,,
43068,AMERICAN WHITE,Firestone Vineyard Sauvignon Blanc,750ML,6,12.49,,
319753,SOUTH AFRICA,INDWE S/BLC,750ML,0,16.49,,
301959,KOSHER,Barkan Classic Rare Red Blend,750ML,1,11.69,,
337171,AMERICAN WHITE,Camelot Chardonnay,1.5L,0,14.69,,
313883,AMERICAN WHITE,Folie a Deux Menage a Trois Pinot Grigio,750ML,121,11.49,,
48382,AMERICAN WHITE,Cuvaison Estate Grown Chardonnay,750ML,7,23.99,,
352242,BRANDY/COGNAC/GRAPPA,ASBACH URALT BRANDY,750ML,138,27.99,,
323745,AMERICAN RED,Vellum Cabernet Sauvignon,750ML,3,71.99,,
80439,AMERICAN RED,Beringer Vineyards Main & Vine Red Crush Red Blend,1.5L,6,12.99,,
24635,AMERICAN WHITE,Sequoia Grove Chardonnay,750ML,37,26.99,,
339270,AMERICAN RED,R Wines Bitch Grenache,750ML,19,16.49,,
47153,AMERICAN BLUSH/ROSE,St. Michaels Winery Gollywobbler Pink Rare Rose Blend,750ML,11,12.99,,
332984,GERMANY,Donnhoff Riesling,750ML,3,27.99,,
323264,ARGENTINA,Casa Bianchi L10 Malbec,750ML,0,16.49,,
39705,AUSTRALIA,The Little Penguin Shiraz,1.5L,57,14.69,,
41162,ASIA,Hakutsuru Organic Junmai Sake,720ML,27,18.99,,
47503,AMERICAN RED,Folie a Deux Menage a Trois Red Zinfandel,750ML,869,11.49,9.99,04/30/2019
336969,KOSHER,Tabor 562 Brut Chardonnay,750ML,1,16.99,,
2844,BEER,Verdi Spumante - 6 Pack,187ML,110,20.99,,
48777,AMERICAN WHITE,Mer Soleil Reserve Chardonnay,750ML,1,30.99,,
18384,AMERICAN RED,SNOQUALMIE CAB/MER,750ML,0,11.99,,
80793,ARGENTINA,Maipe Malbec,750ML,0,9.99,,
307448,CHILE,Vina Siegel San Elias Carmenere,750ML,0,6.79,,
332425,AMERICAN RED,Silver Oak Cabernet Sauvignon,750ML,0,90.99,,
96679,BEER,Grolsch Premium Lager - 6 Pack,12.0Z,299,9.99,,
60488,FRANCE,Maison Nicolas Pinot Noir,750ML,119,8.99,,
25348,TEQUILA,Sauza Extra Gold Tequila,1L,151,19.49,,
70703,MIXERS,Margaritaville Golden Margarita Ready to Drink,1.75L,99,15.49,14.39,04/30/2019
63541,AUSTRALIA,Penfolds Koonunga Hill Shiraz,750ML,68,13.49,,
141372,FRANCE,Monmousseau Justin Monmousseau Vouvray Chenin Blanc,750ML,0,15.49,,
605026,ITALY,Osel Ruche di Castagnole Monferrato,750ML,0,21.99,,
24189,BEER,FULLER VINTAGE ALE 16.9 OZ NR,16.9Z,0,8.99,,
337605,RUM,George Bowman Colonial Era Dark Caribbean Small Batch Rum,1L,0,7.69,,
399574,OTHER WINE,Hakutsuru Draft Sake,180ML,54,3.99,,
59056,AMERICAN RED,Clos du Bois Merlot,375ML,4,11.49,,
81227,AMERICAN WHITE,Woodbridge Lightly Oaked Chardonnay,750ML,27,7.99,,
46035,BOURBON/RYE,Elijah Craig 18 Year Old Single Barrel Kentucky Straight Bourbon Whiskey,750ML,0,99.99,,
166290,AMERICAN TABLE,Far Eastern Shore Autumn Swan Blanc Pinot Gris,750ML,0,13.39,,
5932,BEER,Modelo Especial - 6 Pack,12.0Z,-12,9.99,,
347060,BRANDY/COGNAC/GRAPPA,Camus VS Elegance Cognac,750ML,58,29.99,,
25629,BEER,Paulaner Hefe Weizen Natural Wheat,16.9Z,0,2.99,,
24141,BEER,Uinta Labyrinth Black Ale,750ML,0,16.99,,
317727,ITALY,Villa Jolanda Moscato and Peach Muscat,750ML,39,11.39,,
150916,SPAIN/PORTUGAL,Pazo de Senorans Albarino,750ML,0,22.99,,
49058,VODKA,Three Olives Tartz Vodka,750ML,0,16.99,,
58513,AMERICAN WHITE,Basignani Winery Elena Seyval Blanc,750ML,0,10.99,,
405655,OTHER WINE,Kavakl?dere Angora White Sultana,750ML,1,10.79,,
307740,ITALY,Tavernello Vino Bianco D'Italia Rare White Blend,750ML,0,4.99,,
80279,AMERICAN RED,Vin Vault Malbec,3L,19,20.99,,
337257,AMERICAN RED,Field Recordings Wine Hinterland Vineyard Cabernet Franc,750ML,4,19.99,,
46418,BOURBON/RYE,Jeremiah Weed Bourbon Liqueur 100 Proof,750ML,0,11.49,,
394505,AMERICAN WHITE,VINA ROBLES S/BLC,750ML,0,17.49,,
70523,BOURBON/RYE,Evan Williams Cherry Reserve Liqueur,750ML,35,11.49,,
11085,MISCELLANEOUS IMPORTED,Shinshu Mars Iwai Tradition Japanese Whisky,750ML,83,62.99,,
48071,SPAIN/PORTUGAL,Bodegas Alto Moncayo Garnacha,750ML,4,43.99,,
29602,BEER,The Bruery Jardinier,750ML,0,8.99,,
46173,AMERICAN RED,David Bruce Pinot Noir,750ML,0,32.99,,
5541,BEER,Belhaven Twisted Thistle IPA,16.9Z,0,4.99,,
340492,KOSHER,Teperberg Red Moscato Muscat,750ML,0,10.49,,
35637,VODKA,Fleischmann's Royal Vodka,1.75L,261,12.99,11.49,04/30/2019
40305,AMERICAN RED,Dry Creek Vineyard Meritage,750ML,17,26.99,,
87411,AMERICAN RED,Francis Ford Coppola Director's Cut Pinot Noir,750ML,24,20.99,,
348139,AMERICAN WHITE,Freemark Abbey Viognier,750ML,12,23.99,,
39764,AUSTRALIA,The Little Penguin Chardonnay,1.5L,85,19.69,,
45307,SCOTCH,Auchentoshan 21 Year Old Single Malt Scotch Whisky,750ML,4,175.99,,
306254,KOSHER,Covenant Red C (Kosher) Syrah,750ML,0,37.99,,
18104,CORDIALS,Barenjager Honey Liqueur,750ML,24,24.99,,
47520,TEQUILA,Sauza Tres Generaciones Plata Tequila,750ML,120,32.99,,
62312,BEER,Bitburger Prost Variety Pack - 8 Pack,16.9Z,56,15.99,,
317488,FRANCE,Clos du Mont Olivet Chateauneuf du pape Red Southern Rhone Blend,750ML,0,34.99,,
99668,BEER,Saison Dupont Vieille Provision,750ML,0,12.99,,
47735,TEQUILA,Zapopan Reposado Tequila,1L,0,19.99,,
42780,ITALY,Abbazia Santa Anastasia Terre Siciliane IGP Nero d'Avola,750ML,0,30.99,,
17132,OTHER WINE,Telavi Wine Cellar Marani Red Dry Wine Saperavi,750ML,12,13.99,,
79813,VODKA,Smirnoff Kissed Caramel Vodka,750ML,146,13.49,,
1023,BEER,RCH Ale Mary,500ML,0,6.99,,
341630,AMERICAN RED,Linganore Winecellars Steeplechase Sweet Red Rare Red Blend,1.5L,4,20.99,,
325727,AMERICAN RED,J. Lohr Tower Road Petite Sirah,750ML,23,21.99,,
326862,ITALY,MARRAMIERO MONTPUL DAMA 11,750ML,0,17.99,,
335518,AMERICAN RED,Galerie Pleinair Cabernet Sauvignon,750ML,6,53.99,,
335345,AMERICAN RED,The Hess Collection 19 Block Cuvee Rare Red Blend,375ML,5,12.99,,
32298,AUSTRALIA,Woop Woop Shiraz,750ML,97,13.99,,
77427,VODKA,Georgia Moon Peach Corn Whiskey,750ML,0,11.99,,
428639,AMERICAN RED,De Loach Block 1950 Pinot Noir,750ML,0,17.99,,
45135,CORDIALS,Domaine de Canton French Ginger Liqueur,1L,17,43.99,,
31415,BEER,Evil Twin Westbrook The Perfect Nose,22.0Z,0,28.99,,
1740,BEER,Deus Brut des Flandres,25.4Z,0,33.99,,
312932,FRANCE,Christian Lauverjat Perle Blanche Sancerre Sauvignon Blanc,750ML,85,25.99,,
27405,SPAIN/PORTUGAL,JP TINTO RED,750ML,0,10.99,,
23924,BEER,Yuengling Traditional Lager Can - 15 Pack,24.0Z,0,29.99,,
321870,SPAIN/PORTUGAL,Finca Villacreces Pruno Tempranillo,750ML,1,19.99,,
341247,ARGENTINA,Coliman Malbec,1.5L,0,12.99,,
53309,AMERICAN RED,Frey Organic Zinfandel,750ML,5,19.99,,
74081,RUM,Brugal XV Ron Reserva Rum,750ML,72,25.99,,
349237,AMERICAN RED,Firefly Ridge Merlot,750ML,0,8.99,,
11387,BOURBON/RYE,Kinsey Cask Strength Rye Whiskey,375ML,21,52.99,,
32727,CORDIALS,Kijafa Cherry Liqueur,750ML,193,10.99,,
326754,NEW ZEALAND,Tussock Jumper Sauvignon Blanc,750ML,69,15.39,,
40300,AMERICAN RED,Kenwood Jack London Vineyard Cabernet Sauvignon,375ML,4,19.99,,
312003,OTHER WINE,Bon Appetit Muscat,750ML,4,7.39,,
310315,ARGENTINA,Hacienda Los Haroldos Vinos Con Angel Cabernet Sauvignon,750ML,22,8.99,,
336713,AMERICAN RED,Hidden Ridge Impassable Mountain Reserve Cabernet Sauvignon,750ML,0,107.99,,
317276,KOSHER,Tabor Winery HAR   Mount Tabor Chardonnay,750ML,51,15.99,,
339903,AUSTRALIA,Little Boomey Merlot,1.5L,0,13.99,,
239700,BOURBON/RYE,Isaac Bowman Port Barrel Finished Small Batch Straight Bourbon Whiskey,750ML,149,35.99,,
47917,GERMANY,SCHLOSSGUT DIEL NAHESTEIN RIES,750ML,0,26.99,,
83656,AUSTRALIA,Fisheye Merlot,3L,57,18.99,,
343137,ARGENTINA,Alberto Furque Estate Bottled Malbec,750ML,0,11.49,,
56440,BEER,Deschutes Black Butte Porter - 6 Pack,12.0Z,342,11.99,,
329727,FRANCE,Dourthe La Grande Cuvee Sauvignon Blanc,750ML,4,16.99,,
339012,AMERICAN RED,A.P. Vin Rosella's Vineyard Pinot Noir,750ML,12,61.99,,
25267,AMERICAN RED,Two Angels Petite Sirah,750ML,45,22.99,,
52850,AMERICAN WHITE,Fetzer Anthony's Hill Echo Ridge Sauvignon Blanc,1.5L,130,19.99,,
306611,AMERICAN RED,Chasing Lions Cabernet Sauvignon,750ML,0,15.99,,
311962,ARGENTINA,Finca Los Olmos Mountain Door Castle View Malbec,750ML,0,10.99,,
324240,SPAIN/PORTUGAL,Pessoa da Vinha Reserva Touriga Nacional,750ML,0,12.99,,
43350,TEQUILA,AsomBroso La Rosa Reposado Tequila,750ML,6,67.99,,
337476,ARGENTINA,Vinecol Organic Malbec,750ML,0,11.49,,
77273,IRISH WHISKEY,Paddy Old Irish Whiskey,750ML,0,19.99,,
24802,BEER,Samuel Smith's Organic Chocolate Stout,18.7Z,3,5.99,,
26382,BEER,Gouden Carolus Cuvee Van de Keizer Imperial Blond,750ML,0,14.99,,
80592,ARGENTINA,Valentin Bianchi New Age Rose Malbec,750ML,59,10.49,9.89,04/30/2019
80203,FRANCE,Hob Nob Vineyards Wicked Limited Edition Chardonnay,750ML,11,11.99,,
310381,CHAMPAGNE/SPARKLING,Avissi Prosecco Glera,750ML,3,13.99,,
43468,AMERICAN WHITE,Kiona Chenin Blanc,750ML,1,15.99,,
338638,ITALY,Giol Organic Marca Trevigiana IGT Merlot,750ML,2,9.79,,
40838,AMERICAN RED,Firestone Vineyard Jarhead Red Rare Red Blend,750ML,9,20.99,,
330281,AMERICAN WHITE,Red Tail Ridge Winery Good Karma Riesling,750ML,1,15.49,,
306876,AMERICAN RED,Tangley Oaks Lot #15 Pinot Noir,750ML,76,19.99,,
84509,AMERICAN RED,Corbett Canyon Pinot Noir,3L,21,16.99,,
166307,AMERICAN RED,Cakebread Cellars Merlot,750ML,12,58.99,,
349581,ITALY,Massucco Nebbiolo d'Alba,750ML,0,18.69,,
84307,AMERICAN RED,Edna Valley Vineyard Pinot Noir,750ML,280,14.49,,
74810,AMERICAN WHITE,Cambria Bench Break Chardonnay,750ML,222,20.99,16.99,04/30/2019
63231,FRANCE,Barton & Guestier Reserve Cabernet Sauvignon,1.5L,3,12.99,,
43497,FRANCE,Hob Nob Vineyards Chardonnay,750ML,6,11.39,,
342119,AMERICAN RED,Linganore Winecellars Red Skins Dry Red Reserve Cabernet Sauvignon,750ML,9,19.99,,
15156,SCOTCH,Dalwhinnie 15 Year Old Highland Single Malt Scotch Whisky,750ML,145,60.99,,
33545,AMERICAN WHITE,Frey Natural White Organic Chenin Blanc,750ML,33,13.49,,
303042,AMERICAN WHITE,Douglas Green The Beach House Sauvignon Blanc,750ML,54,10.49,,
68268,PORT/SHERRY/DESSERT/VERMOUTH,Hartley & Gibson's Cream Palomino,750ML,93,11.99,,
428507,AMERICAN RED,Tomasello Winery Red Raspberry Wine Red Blend,500ML,5,11.49,,
23416,BEER,Milwaukee's Best Ice Can - 12 Pack,24.0Z,0,15.99,,
321441,FRANCE,Cave de Lugny La Cote Blanche Estate Bottled Macon Villages Chardonnay,750ML,0,13.49,,
306306,OTHER WINE,Vinaria Bostavan The Winemaker's Special Dessert Cabernet Sauvignon,750ML,4,13.99,,
94293,BEER,O'Doul's Amber Non Alcoholic Beer - 6 Pack,12.0Z,432,7.99,,
42095,AMERICAN RED,Paraduxx (Duckhorn Vineyards) Proprietary Red Cabernet Sauvignon,750ML,101,43.99,,
24886,BEER,Green Flash Palate Wrecker,22.0Z,0,10.99,,
40962,AMERICAN RED,Hahn Merlot,750ML,8,15.99,,
94340,BEER,Sharp's Non Alcoholic - 6 Pack,12.0Z,120,6.99,,
80133,BEER,Samuel Adams Sam '76 Can - 12 Pack,12.0Z,12,19.99,,
27651,BEER,Delirium Red,750ML,0,10.99,,
317645,ITALY,Siema Vineyards Asti Soprano Dolce Asti White Blend,750ML,0,12.69,,
319234,AMERICAN RED,Folio (Michael Mondavi Family) Canvas Pinot Noir,750ML,0,11.99,,
341331,AMERICAN WHITE,Stone Hill Estate Bottled Dry White Vidal Blanc,750ML,0,9.99,,
61565,AMERICAN WHITE,Robert Mondavi Winery Fume Blanc Reserve To Kalon Vineyard Sauvignon Blanc,750ML,8,53.99,,
83524,AMERICAN RED,Barefoot Cellars Sangria Red Blend,1.5L,118,15.49,,
329107,OTHER WINE,Wip Srl Winemaker Ciumai Garling Collection Red Off Dry Cabernet Sauvignon,750ML,0,15.49,,
334156,KOSHER,Gush Etzion Lone Oak Reserve Cabernet Sauvignon,750ML,0,38.99,,
114324,AMERICAN WHITE,Chalk Hill Chardonnay,750ML,1,41.99,,
112283,ITALY,Di Lenardo Unoaked Venezia Giulia IGT Pinot Grigio,750ML,7,10.79,,
382140,ITALY,Farnese Fantini Montepulciano D'Abruzzo DOC,1.5L,0,16.49,,
300475,SPAIN/PORTUGAL,Bodegas y Vinedos del Jalon Claraval Seleccion Especial Grenache,750ML,0,13.69,,
29558,BEER,BFM Vintage 2014 Abbaye de St. Bon Chien,25.0Z,0,27.99,,
24349,BEER,Brasserie Dupont Avec Les Bons Voeux,22.0Z,0,12.99,,
368091,CHAMPAGNE/SPARKLING,Ferrari Brut Metodo Classico Trento Chardonnay,750ML,0,23.99,,
306161,ITALY,La Slina Rocco Rosso Dolcetto di Ovada,750ML,0,10.99,,
333761,FRANCE,Carneros Hills Winery Chardenet Coteau Blanc Chardonnay,750ML,0,18.49,,
52060,AMERICAN RED,J. Lohr Los Osos Merlot,375ML,16,8.49,,
237138,SPECIALTY,Tenth Ward Distilling Company Smoked Corn Whiskey,750ML,93,29.99,,
348830,SPAIN/PORTUGAL,TXAKOLI TXOMIA ETANIZ,750ML,0,21.99,,
1767,BEER,Pauwel Kwak - 6 Pack,25.4Z,0,66.99,,
73259,TEQUILA,Maestro Dobel Humito Smoked Silver Tequila,750ML,25,45.99,,
311304,ITALY,Alta Luna Vigneti Delle Dolomiti IGT Pinot Grigio,750ML,0,14.49,,
48275,AMERICAN RED,Barboursville Vineyards Reserve Cabernet Franc,750ML,15,24.99,,
348006,AMERICAN RED,Clos du Val Cabernet Sauvignon,750ML,4,59.99,,
70071,CORDIALS,John DeKuyper & Sons 03 Premium Orange Liqueur,750ML,125,17.49,,
48919,BEER,Hoop Tea Watermelon Mint Green Tea,3L,0,23.99,,
347646,AMERICAN RED,Big Smooth Cellars Cabernet Sauvignon,750ML,16,17.69,,
80690,AMERICAN RED,Barefoot Cellars Box Pinot Noir,3L,72,19.99,,
351370,FRANCE,Chateau Bel Air Bordeaux Blend,750ML,143,11.99,,
70629,BRANDY/COGNAC/GRAPPA,Metaxa 5 Star Brandy,750ML,138,25.99,,
10677,RUM,Brinley Gold Shipwreck Vanilla Rum,750ML,0,25.99,,
29374,BEER,Sonoma The Pitchfork Pear Cider,22.0Z,0,7.99,,
75760,CORDIALS,TUACA Liqueur,750ML,159,21.99,,
81492,AMERICAN WHITE,Smoking Loon The Original Pinot Grigio,750ML,81,11.49,,
441075,ARGENTINA,Las Perdices Reserva Pinot Noir,750ML,0,16.99,,
421430,ITALY,G.D. Vajra Dolcetto d'Alba,750ML,0,17.49,,
413445,KOSHER,Weinstock Cellars White by W Rare White Blend,750ML,20,9.99,,
40833,CHILE,Viu Manent Rose Malbec,750ML,0,12.99,,
82048,AMERICAN WHITE,CK Mondavi Willow Springs Pinot Grigio,1.5L,46,14.49,,
313251,GERMANY,Joh. Jos. Prum Kabinett Riesling,750ML,3,23.99,,
29601,BEER,Bruery Terreux Beret,750ML,0,17.99,,
24835,BEER,Stift Engelszell Gregorius,11.0Z,0,6.99,,
335702,SPAIN/PORTUGAL,Vidorra Real Sangria Grenache,3L,7,16.69,,
10120,BOURBON/RYE,J.W. Dant Bottled In Bond  Kentucky Straight Bourbon Whiskey,1.75L,58,28.99,,
348023,BEER,Evil Twin Kolata IPA - 4 Pack,16.0Z,0,15.99,,
325089,AMERICAN WHITE,Millstone Cellars Hopvine Cider,750ML,0,18.49,,
46729,AMERICAN WHITE,Napa Cellars Chardonnay,750ML,0,17.49,,
25932,BEER,Hofbrau Hefe Weizen,16.9Z,0,2.99,,
327521,AMERICAN WHITE,Chloe Wines Chloe Valdadige   Etschtaler Pinot Grigio,750ML,273,14.49,,
14699,AMERICAN RED,Gnekow Family Winery Old Vine Campus Oaks Zinfandel,750ML,0,38.99,,
81170,FRANCE,Chateau Reynon Cotes de Bordeaux Bordeaux Blend,750ML,12,17.39,,
82580,ITALY,Santa Cristina (Antinori) Santa Cristina Delle Venezie IGT Pinot Grigio,750ML,92,11.99,,
44865,ITALY,Marchesi de' Frescobaldi Castello di Nipozzano Montesodi Toscana IGT Sangiovese,750ML,2,42.99,,
83529,AMERICAN RED,B.R. Cohn Silver Label Cabernet Sauvignon,750ML,152,20.99,,
34215,AUSTRALIA,Thorn Clarke Shotfire (Ridge) Shiraz,750ML,28,18.49,,
16225,AMERICAN RED,Willamette Valley Vineyards Whole Cluster Pinot Noir,750ML,40,24.99,,
20257,AMERICAN RED,Adelsheim Elizabeth's Reserve Pinot Noir,750ML,3,67.99,,
331126,SPAIN/PORTUGAL,Vina Galana Tempranillo,750ML,8,11.99,,
337603,GERMANY,Graff Kabinett Riesling,750ML,0,12.69,,
22310,BEER,Old Speckled Hen - 6 Pack,12.0Z,48,14.99,,
311341,SPAIN/PORTUGAL,Vina Eguia Tempranillo,750ML,1,9.99,,
313539,OTHER WINE,Traviata Pinot Grigio,1.5L,0,10.49,,
181064,AUSTRALIA,Oxford Landing Merlot,750ML,0,11.39,,
28172,BEER,Dupont Foret Libre,750ML,0,13.99,,
12671,BOURBON/RYE,Rebel Yell Kentucky Straight Bourbon Whiskey,750ML,11,14.49,,
25343,BEER,Shmaltz He'brew Hop Manna IPA,22.0Z,0,7.99,,
51033,BEER,Heavy Seas Cannon Crew Sampler Can - 12 Pack,12.0Z,48,20.99,,
438456,SPAIN/PORTUGAL,DFJ Vinhos Grand'Arte Shiraz,750ML,9,10.99,,
48475,ITALY,Lorenzo Begali Recioto Della Valpolicella Valpolicella Blend,500ML,3,35.99,,
335927,FRANCE,Chateau La Mouliniere Rose Bordeaux Blend,750ML,20,12.69,,
166492,AMERICAN TABLE,Folie a Deux Menage a Trois Sparkling Rose Raboso,750ML,153,10.99,,
55204,PORT/SHERRY/DESSERT/VERMOUTH,Four Seasons Collection Late Harvest White Moscato Dessert Muscat,500ML,29,7.69,,
21660,AMERICAN RED,Guenoc Cabernet Sauvignon,750ML,10,8.99,,
234668,AMERICAN TABLE,BeatBox Beverages Fruit Punch,5L,3,25.99,,
160318,SOUTH AFRICA,Ken Forrester Petit Pinotage,750ML,89,13.39,,
342452,KOSHER,Covenant Lavan,750ML,12,38.99,,
63452,FRANCE,Maison Nicolas Merlot,750ML,168,8.99,,
72532,CHILE,Walnut Crest (Emiliana) Merlot,1.5L,34,12.99,,
97314,BEER,Dos Equis Ambar - 12 Pack,12.0Z,117,16.99,,
337013,ITALY,Alcesti L' Isola dei Profumi Terre Siciliane IGT Catarratto,750ML,0,6.99,,
19445,AMERICAN WHITE,Estrella River Winery Proprietor's Reserve Chardonnay,750ML,22,6.79,,
381756,FRANCE,Domaine des Cadastres Picpoul de Pinet,750ML,13,9.99,,
348424,AMERICAN RED,7 Moons Dark Side Red Blend,750ML,186,12.49,,
41607,ITALY,Cavit Collection Provincia di Pavia IGT Riesling,1.5L,0,18.99,,
306114,SPAIN/PORTUGAL,Casa Santos Lima LAB Portuguese Red Blend,1.5L,0,12.69,,
319802,CORDIALS,Barenjager Honey & Bourbon Liqueur,1L,18,30.99,,
62480,ITALY,Vinicola Savese Pichierri Terrarossa Primitivo di Manduria,750ML,29,18.49,,
437611,PORT/SHERRY/DESSERT/VERMOUTH,Maison Dolin & Cie Vermouth de Chambery Blanc Rare White Blend,750ML,106,16.49,,
309232,ITALY,Folie a Deux Menage a Trois Moscato,750ML,30,10.99,,
23664,BEER,The Bruery Mischief,25.4Z,0,10.99,,
48297,CORDIALS,Binyamina Liqueur Amaretto,750ML,32,16.49,,
84606,ITALY,Rosatello Moscato Blanco Muscat,750ML,154,11.99,,
406120,OTHER WINE,Grooner Gruner Veltliner,750ML,3,10.99,,
346949,BOURBON/RYE,Belle Meade 9 Year Old Sherry Cask Finish Bourbon Whiskey,750ML,26,79.99,,
23537,BEER,Blue Moon Limited Release Summer Honey Wheat - 6 Pack,12.0Z,346,9.99,,
326982,KOSHER,Terra Vega Syrah,375ML,0,5.79,,
310070,ARGENTINA,Andean Vineyards Condor Peak Malbec,750ML,0,10.99,,
24762,BEER,LAUGHING DOG IPA 24/12 OZ NR,12.0Z,0,2.99,,
347742,GIN,Battle Standard 142 Standard Strength Gin,750ML,0,30.99,,
3719,BEER,Ommegang Three Philosophers,25.4Z,9,11.99,,
70606,VODKA,Pinnacle Tropical Punch Vodka,750ML,99,10.99,,
23951,BEER,Sierra Nevada Torpedo Extra IPA - 12 Pack,12.0Z,109,20.99,,
319834,AUSTRALIA,M. Chapoutier Tournon Mathilda Shiraz,750ML,13,17.39,,
305555,FRANCE,Lionel Osmin Estate Bottled Pied De Perdrix,750ML,0,12.49,,
53660,PORT/SHERRY/DESSERT/VERMOUTH,Colombo Fine Sweet Marsala Inzolia,1.5L,0,22.99,,
73873,AMERICAN TABLE,Mogen David MD 20/20 Peaches and Cream White Blend,750ML,1,4.39,,
310919,AMERICAN RED,Darcie Kent Vineyards Cabernet Sauvignon,750ML,1,10.49,,
70040,BOURBON/RYE,John J. Bowman Pioneer Spirit Single Barrel Virgina Straight Bourbon Whisky,750ML,0,47.99,,
70524,IRISH WHISKEY,Powers John's Lane Release 12 Year Old Single Pot Still Irish Whiskey,750ML,0,58.99,,
313382,AMERICAN RED,Maison L'Envoye Two Messengers Pinot Noir,750ML,10,30.99,,
57100,CORDIALS,Godiva White Chocolate Liqueur,750ML,117,27.99,,
352238,AMERICAN RED,Whitehall Lane Tre Leoni Cabernet Sauvignon,750ML,0,44.99,,
44361,OTHER WINE,"Telavi Wine Cellar Marani Tsinandali Estate Bottled Rare White Blend, Rkatsiteli, Mtsvane",750ML,0,13.99,,
405302,AMERICAN RED,Elk Run Red Door Maryland Table Wine Rare Red Blend,750ML,0,14.99,,
330657,ARGENTINA,Diseno Red Blend,750ML,2,14.49,,
308977,SOUTH AFRICA,Jam Jar Sweet White Muscat,750ML,147,10.39,,
315153,ITALY,Tenuta Polvaro Polvaro Nero Venezia Cabernet Sauvignon,750ML,11,16.99,,
80453,GREECE,Achaia Clauss Demestica Moschofilero,750ML,14,11.99,,
77026,VODKA,Smirnoff Pomegranate Vodka,1L,0,15.99,,
347461,ARGENTINA,Bodega Ruca Malen Aime Malbec,750ML,0,10.39,,
382965,SPAIN/PORTUGAL,Bodegas Volver Single Vineyard Tempranillo,750ML,23,16.99,,
340369,GERMANY,Selbach Kabinett Trutta Fario Fish Label Riesling,750ML,13,21.99,,
81282,AMERICAN RED,Martinelli Terra Felice Syrah,750ML,6,32.99,,
80190,AMERICAN WHITE,Big House Wine Company The Great Escape Chardonnay,3L,2,20.99,,
312304,ITALY,Fattoria San Fabiano Conti Borghini Baldovinetti Putto Chianti DOCG Chianti Blend,750ML,0,13.99,,
86215,AMERICAN RED,Fetzer Eagle Peak Merlot,750ML,98,10.49,,
85505,AMERICAN BLUSH/ROSE,Barefoot Cellars Refresh Perfectly Pink Spritzer Grenache,750ML,1,7.49,,
341524,NEW ZEALAND,Lila Wines Sauvignon Blanc,250ML,0,2.79,,
51438,AMERICAN WHITE,Byron Nielson by Byron Chardonnay,750ML,-2,24.99,,
323348,AMERICAN RED,The Archivist Pinot Noir,750ML,0,13.99,,
70744,BOURBON/RYE,Maker's Mark Cask Strength Kentucky Straight Bourbon Whisky,750ML,107,42.99,,
84649,OTHER WINE,Bulgariana Chardonnay,750ML,8,14.69,,
13560,AMERICAN WHITE,Grgich Hills Estate Grown Chardonnay,750ML,30,67.99,,
316728,SPECIALTY,MB Roland Kentucky Apple Pie Moonshine 45 Proof,750ML,0,25.99,,
63894,FRANCE,Baron Philippe de Rothschild Mouton Cadet Blanc White Bordeaux Blend,1.5L,46,24.99,,
339858,AMERICAN WHITE,WindRacer Pinot Noir,750ML,3,37.99,,
333561,ITALY,Bernabei Extra Dry Prosecco di Conegliano Valdobbiadene Glera,750ML,0,15.49,,
313444,AMERICAN RED,Wilder Winery Merlot,750ML,1,9.49,,
84551,AMERICAN RED,Wild Horse Cabernet Sauvignon,750ML,50,19.99,,
45893,CHAMPAGNE/SPARKLING,Henkell Blanc de Blancs Dry Sec Rare White Blend,750ML,0,6.49,,
308870,AMERICAN RED,WILLIAMETTE VALLEY P/NOIR,750ML,0,30.99,,
71059,RUM,Dos Maderas 5+5 PX Rum,750ML,0,51.99,,
26293,BEER,Budweiser & Clamato Chelada,25.0Z,0,3.99,,
323556,AMERICAN RED,Jason Stephens Winery Estate Cabernet Sauvignon,750ML,0,18.49,,
45977,TEQUILA,Margaritaville Calypso Coconut Tequila,750ML,1,12.29,,
29416,CANADIAN/BLENDED WHISKEY,Canadian Mist Blended Canadian Whisky,1L,0,11.29,,
82507,AMERICAN WHITE,Barefoot Cellars Refreshingly Sweet Riesling,187ML,268,1.89,,
338239,AMERICAN WHITE,Cambria Clone 4 Estate Grown & Bottled Chardonnay,750ML,12,20.99,,
73870,SPECIALTY,Fannie Tutt's Lemon Meringue Moonshine,750ML,33,28.99,,
310442,AMERICAN WHITE,Carmel Road Liberated Riesling,750ML,11,17.49,,
330699,CANADIAN/BLENDED WHISKEY,Semper Fi Corn Whiskey,750ML,0,35.99,,
19623,SCOTCH,Cardhu 12 Year Old Speyside Single Malt Scotch Whisky,750ML,53,42.99,,
21806,PORT/SHERRY/DESSERT/VERMOUTH,Fonseca Late Bottled Vintage Unfiltered Red Port,750ML,91,23.99,,
28511,BEER,LEINENKUGEL SHANDY SAMPLER 2/12 CAN - 12 Pack,12.0Z,0,18.99,,
360430,ARGENTINA,Familia Mayol Cuatro Primos Rare Red Blend,750ML,3,20.99,,
330210,AMERICAN WHITE,CASTARO MER,750ML,0,16.49,,
68225,PORT/SHERRY/DESSERT/VERMOUTH,Williams & Humbert Dry Sack Medium Palomino,750ML,148,15.99,,
84116,CHILE,Errazuriz Max Reserva Chardonnay,750ML,21,19.99,,
57460,AMERICAN WHITE,Frog's Leap Sauvignon Blanc,750ML,3,28.99,,
300547,RUM,Cruzan Tropical Fruit Rum,750ML,4,10.99,,
36795,BEER,Ritas Passion Fruit Rita - 12 Pack,8.0Z,12,18.99,,
30843,BEER,New Belgium Glutiny Pale Ale - 6 Pack,12.0Z,66,9.99,,
48299,TEQUILA,Los Arango Blanco Tequila,750ML,0,32.99,,
81893,AMERICAN WHITE,Wild Horse Chardonnay,750ML,85,16.49,,
29650,BEER,Oskar Blues IPA - 6 Pack,12.0Z,0,10.99,,
85272,ARGENTINA,Bodegas Callia Alta Malbec,750ML,70,10.49,,
427685,AUSTRALIA,Paul Direder Gruner Veltliner,1L,15,10.49,,
328660,FRANCE,Clotilde Davenne Bourgogne Blanc Chardonnay,750ML,0,17.49,,
78832,BEER,Dogfish Head Raison D'Extra - 4 Pack,12.0Z,273,33.99,,
325856,ITALY,ROCCHE COSTAMAGNA NEB,750ML,0,15.49,,
307159,OTHER WINE,KINDZMARAULI CERAMIC MERANI,750ML,0,21.99,,
25838,BEER,Zhujiang Pearl River,600ML,0,2.99,,
24838,BEER,CHIMAY GRANDE RESERVE 2012 12/,750ML,0,19.99,,
70971,AMERICAN RED,Seghesio Family Vineyards Old Vines Zinfandel,750ML,14,47.99,,
48300,SCOTCH,Walders Scotch & Coffee Liqueur,750ML,4,22.99,,
166242,AMERICAN TABLE,Clos de los Siete Rare Red Blend,750ML,89,17.99,15.99,04/30/2019
365700,FRANCE,Christian Lauverjat Moulin des Vrilleres Sancerre Sauvignon Blanc,375ML,0,17.39,,
